,Alcohol,Appellation,Bottle Size,Category,Country,Date Published,Description,Designation,Name,Price,Province,Rating,Region,Subregion,User Avg Rating,Variety,Vintage,Winery
135,14.5%,"Sonoma Coast, Sonoma, California, US",750 ml,White, US,5/1/2021,"
                      This is a barrel-fermented white that opens in high-toned lemon and floral apple blossom—the oak and oomph subtle despite its full-bodied ripeness. Grapefruit, green apple and toast do a good job of complementing the brightness and tang of the fruit.                      Virginie Boone ",Parched,Bougetz 2018 Parched Chardonnay (Sonoma Coast),$25, California,92, Sonoma,Sonoma Coast,Not rated yet [Add Your Review],Chardonnay,2018,Bougetz
136,13.8%,"Edna Valley, Central Coast, California, US",750 ml,White, US,5/1/2021,"
                      Hints of coconut, meringue and light nectarine make for a suavely integrated nose on this bottling. It's pure and crisp on the palate with citrus-peel and tart apple flavors, leading into warmer spices on the finish.                      Matt Kettmann ",Bee Sweet Vineyard,Stephen Ross 2018 Bee Sweet Vineyard Chardonnay (Edna Valley),$42, California,92, Central Coast,Edna Valley,Not rated yet [Add Your Review],Chardonnay,2018,Stephen Ross
137,14%,"Hawke's Bay, New Zealand",750 ml,White, New Zealand,5/1/2021,"
                      This is a riper, more approachable vintage than the 2017 Elston. It opens with appealing notes of melon, apricot marmalade and barrel-driven butterscotch aromas. Marmalade is the dominant flavor on the full-figured palate as well, providing a pithy bite of refreshment amid a broad, slippery texture. Drink now–2026.                      Christina Pickard ",Elston,Te Mata 2018 Elston Chardonnay (Hawke's Bay),$35,Hawke's Bay,92,,,Not rated yet [Add Your Review],Chardonnay,2018,Te Mata
138,13.7%,"Santa Cruz Mountains, Central Coast, California, US",750 ml,White, US,5/1/2021,"
                      There's a distinct aroma of wet chalk, wool and even labneh on the nose of this bottling (from a vineyard planted in 1981), which begins to open to lemon and warmer cream, with patience and air. The chalky texture of the sip is incredibly compelling, framing mellow lines of lemon and melon rind. Expect these elements to coalesce into something stunning with time. Drink now through 2032.                      Matt Kettmann ",Albutom Vineyard,Thomas Fogarty 2017 Albutom Vineyard Chardonnay (Santa Cruz Mountains),$72, California,92, Central Coast,Santa Cruz Mountains,Not rated yet [Add Your Review],Chardonnay,2017,Thomas Fogarty
139,14.3%,"Sta. Rita Hills, Central Coast, California, US",750 ml,White, US,5/1/2021,"
                      Baked pear, warm apricot brioche, toasted nuts and yuzu peel show on the nose of this bottling. The palate is rich in flavors of baked pineapple, buttered apple and warm toast lifted by just enough lemon zest and minerality to balance the marzipan finish.                      Matt Kettmann ",Courtney's Vineyard,Two Sisters 2017 Courtney's Vineyard Chardonnay (Sta. Rita Hills),$50, California,92, Central Coast,Sta. Rita Hills,Not rated yet [Add Your Review],Chardonnay,2017,Two Sisters
140,13.4%,"Monterey, Central Coast, California, US",750 ml,White, US,5/1/2021,"
                      Rich hints of lightly seared marshmallow, meringue and peach custard are cut by dried lemon peel and hazelnut aromas on the nose of this bottling. The palate is very grippy in texture, with strong lemon-peel acidity and stony minerality leading into a nuttier, butterscotch-touched finish.                      Matt Kettmann ",Pelio Upper Block,Seabold Cellars 2018 Pelio Upper Block Chardonnay (Monterey),$45, California,92, Central Coast,Monterey,Not rated yet [Add Your Review],Chardonnay,2018,Seabold Cellars
141,13%,"Hemel-en-Aarde Ridge, South Africa",750 ml,White, South Africa,5/1/2021,"
                      Beautifully precise aromas of orange rind, crisp yellow apple, soft toast and delicate wood spice dance on the bouquet of this lovely Chardonnay. The palate is focused and pure, with ample ripe fruit that is framed by bright, supportive acidity and a pronounced mineral impression that unfolds on the long, evolving close alongside a kiss of saline.                      Lauren Buzzeo ",,Tesselaarsdal 2019 Chardonnay (Hemel-en-Aarde Ridge),$40,Hemel-en-Aarde Ridge,92,,,Not rated yet [Add Your Review],Chardonnay,2019,Tesselaarsdal
142,14.2%,"Los Carneros, Napa-Sonoma, California, US",750 ml,White, US,5/1/2021,"
                      Opening in a wealth of baking-spice and apple-blossom aromas, this white has tingly acidity and impressive structure: the ripeness balanced and well-integrated with the oak and intensity. Old World grace comes to mind throughout, with a steely, earthy finish.                      Virginie Boone ",Proprietress Reserve,Vine Cliff 2018 Proprietress Reserve Chardonnay (Los Carneros),$65, California,92, Napa-Sonoma,Los Carneros,Not rated yet [Add Your Review],Chardonnay,2018,Vine Cliff
143,13%,"Beechworth, Victoria, Australia",750 ml,White, Australia,5/1/2021,"
                      This is a classy example of just how far Australian Chardonnay has come over the past decade or so. From a small-but-mighty cool climate region in Victoria, it's a sturdy, mouthfilling wine with a lick of toasty oak, but it never goes overboard, neatly supporting the bright lemon, nougat and seashell characters and setting the stage for a silky-textured, cellarworthy and highly food-friendly wine. Drink now–2028.                      Christina Pickard ",Smith's Vineyard,Fighting Gully Road 2017 Smith's Vineyard Chardonnay (Beechworth),$63, Victoria,92,Beechworth,,Not rated yet [Add Your Review],Chardonnay,2017,Fighting Gully Road
144,14.3%,"Sta. Rita Hills, Central Coast, California, US",750 ml,White, US,5/1/2021,"
                      Soft and creamy aromas of peach and apricot meet with daffodil and honeysuckle on the delicate but full nose of this bottling by actor Kurt Russell, named for his wife, Goldie Hawn. The sip is surrounded in a chalky grip, offering fresh and generous flavors of white peach and cream.                      Matt Kettmann ",Goldie,GoGi 2018 Goldie Chardonnay (Sta. Rita Hills),$50, California,92, Central Coast,Sta. Rita Hills,Not rated yet [Add Your Review],Chardonnay,2018,GoGi
145,13.5%,"Adelaide Hills, South Australia, Australia",750 ml,White, Australia,5/1/2021,"
                      Croft neatly displays the bright, fleshy fruit of the Adelaide Hills in this polished and ageworthy-yet-drinkable Chard. There's an abundance of melon, peach and red apple aromas on the nose, and some vanilla bean, too. The palate is equally fruity and full figured, the textural roundness buoyed by bright acidity. A well-balanced wine for drinking now or until around 2029.                      Christina Pickard ",Croft,Henschke 2018 Croft Chardonnay (Adelaide Hills),$60, South Australia,92,Adelaide Hills,,Not rated yet [Add Your Review],Chardonnay,2018,Henschke
146,14.6%,"Los Carneros, Napa-Sonoma, California, US",750 ml,White, US,5/1/2021,"
                      Named for the winery's founding family, this white is floral, textured and oak laden, with dense layers of pineapple and stone fruit. Made in a hearty, creamy style, the fruit is encased in caramel brioche and notes of nutmeg and cinnamon.                      Virginie Boone ",ATS Estate Grown,Cuvaison 2018 ATS Estate Grown Chardonnay (Los Carneros),$60, California,92, Napa-Sonoma,Los Carneros,Not rated yet [Add Your Review],Chardonnay,2018,Cuvaison
147,14%,"Los Carneros, Napa-Sonoma, California, US",750 ml,White, US,5/1/2021,"
                      With an entry that is oak-driven in caramel and toast, this wine is layered and moderately structured, with fresh bursts of white peach and apple that shine a light on the underlying acidity. That freshness endures and lifts the lemony finish.                      Virginie Boone ",Estate Vineyard,Artesa 2018 Estate Vineyard Chardonnay (Los Carneros),$38, California,92, Napa-Sonoma,Los Carneros,Not rated yet [Add Your Review],Chardonnay,2018,Artesa
148,14.2%,"Sonoma Coast, Sonoma, California, US",750 ml,White, US,5/1/2021,"
                      Made in a lush style with a broad, appealing fleshiness and velvety texture, this wine shows off the vineyard well, mixing cool coastal components of acidity and minerality with California richness. Pineapple, pear and baking spice dominate around notes of oak and flint.                      Virginie Boone ",Durell Vineyard,Fulcrum 2018 Durell Vineyard Chardonnay (Sonoma Coast),$49, California,91, Sonoma,Sonoma Coast,Not rated yet [Add Your Review],Chardonnay,2018,Fulcrum
149,14.8%,"Mount Veeder, Napa, California, US",750 ml,White, US,5/1/2021,"
                      Floral, this wine is intensely full bodied and spicy in oak, with strong, full-bodied flavors of Gravenstein apple, Meyer lemon and pear. The mountain appellation imparts dry, prominent tannins and an enduring earthiness.                      Virginie Boone ",Small Block,Hess Collection 2018 Small Block Chardonnay (Mount Veeder),$55, California,91, Napa,Mount Veeder,Not rated yet [Add Your Review],Chardonnay,2018,Hess Collection
150,13.5%,"Walker Bay, South Africa",750 ml,White, South Africa,5/1/2021,"
                      This smells quite rich and opulent, with aromas of creamed melon, buttered nuts and baked apples on the nose. The mouthfeel is round and rich, with sweet oak spice and a baked apple flavor that are met by a cut of citrus-tinged acidity and a delicately pithy texture. The medium-length finish shows good evolution, ending with an impression of toasted whole spice.                      Lauren Buzzeo ",Reserve,Creation 2018 Reserve Chardonnay (Walker Bay),$35,Walker Bay,91,,,Not rated yet [Add Your Review],Chardonnay,2018,Creation
151,13.9%,"Sta. Rita Hills, Central Coast, California, US",750 ml,White, US,5/1/2021,"
                      Tangy lemon and Mandarin aromas meet with a core of buttered apricot on the nose of this bottling. There's a firm tension to the sip, where toasted nut, sea salt and citrus peel flavors are enhanced by a crushed seashell minerality.                      Matt Kettmann ",Rancho Santa Rosa,Lincourt 2017 Rancho Santa Rosa Chardonnay (Sta. Rita Hills),$35, California,91, Central Coast,Sta. Rita Hills,Not rated yet [Add Your Review],Chardonnay,2017,Lincourt
152,14.1%,"Russian River Valley, Sonoma, California, US",750 ml,White, US,5/1/2021,"
                      This wine opens in a whirl of tropical-fruit cup, olive juice and sweet oak, evolving in the glass to reveal a fleshy, lush texture of rounded richness. The tannin structure provides an impressive foundation.                      Virginie Boone ",Reserve,Fritz Underground 2017 Reserve Chardonnay (Russian River Valley),$45, California,91, Sonoma,Russian River Valley,Not rated yet [Add Your Review],Chardonnay,2017,Fritz Underground
153,14.5%,"Carneros, Napa-Sonoma, California, US",750 ml,White, US,5/1/2021,"
                      With a mineral-like stone character, this white is edgy in floral and earthy components that accent a robust, full-bodied style etched in oak and caramel. The fruit is richly layered pear and peach, with a side note of papaya, accentuating the overall richness of the wine.                      Virginie Boone ",Sangiacomo Vineyard,Poundstone 2018 Sangiacomo Vineyard Chardonnay (Carneros),$40, California,91, Napa-Sonoma,Carneros,Not rated yet [Add Your Review],Chardonnay,2018,Poundstone
154,13.8%,"Edna Valley, Central Coast, California, US",750 ml,White, US,5/1/2021,"
                      Bright on the nose with fresh lime blossoms, lemon-zest, crisp nectarine and light oyster-shell aromas, this is a solid appellation blend by veteran Stephen Ross Dooley. A pithy grip frames the sip, where richer hints of browned butter and dried apple emerge against the brisk citrus elements.                      Matt Kettmann ",,Stephen Ross 2018 Chardonnay (Edna Valley),$28, California,91, Central Coast,Edna Valley,Not rated yet [Add Your Review],Chardonnay,2018,Stephen Ross
155,14.2%,"Los Carneros, Napa-Sonoma, California, US",750 ml,White, US,5/1/2021,"
                      With a buttery, creamy entry, this bold white offers a warmth of toasted oak, lightening on the midpalate to reveal crisp elements of green apple, stone fruit and lime. A lift of acidity emphasizes the high tones and floral aromatics, finishing balanced and textured.                      Virginie Boone ",Coeurtina,Cuvaison 2018 Coeurtina Chardonnay (Los Carneros),$50, California,91, Napa-Sonoma,Los Carneros,Not rated yet [Add Your Review],Chardonnay,2018,Cuvaison
156,13.9%,"Los Carneros, Napa-Sonoma, California, US",750 ml,White, US,5/1/2021,"
                      Sleek and stony, with a lovely texture of lemon peel and peach fuzz, this white is light bodied and balanced, with moderate use of oak. The acidity is lively and helps the wine to retain an enduring freshness that is huge in appeal.                      Virginie Boone ",,Artesa 2018 Chardonnay (Los Carneros),$23, California,91, Napa-Sonoma,Los Carneros,Not rated yet [Add Your Review],Chardonnay,2018,Artesa
157,14.5%,"Sonoma Coast, Sonoma, California, US",750 ml,White, US,5/1/2021,"
                      Floral and earthy on the nose in apple blossom and sea spray, this coastal wine begins light in crisp green apple and Meyer lemon as it develops a hearty backbone of powerful intensity and lush texture. Full bodied, it retains an expansive mouthfeel and oak-influenced finish.                      Virginie Boone ",Platt Vineyard,Crescere 2017 Platt Vineyard Chardonnay (Sonoma Coast),$100, California,91, Sonoma,Sonoma Coast,Not rated yet [Add Your Review],Chardonnay,2017,Crescere
158,13.4%,"Central Coast, Central Coast, California, US",750 ml,White, US,5/1/2021,"
                      Lots of lemongrass and lime-blossom aromas make for a very fresh and zesty nose on this bottling, which also shows grapefruit-peel and oyster-shell elements. The palate is very tightly woven, with lemon-flesh and pomelo-peel flavors proving very sharp and laser-focused. Drink now through 2034.                      Matt Kettmann ",No Oak Heritage,Tolosa 2019 No Oak Heritage Chardonnay (Central Coast),$23, California,91, Central Coast,Central Coast,Not rated yet [Add Your Review],Chardonnay,2019,Tolosa
159,14.3%,"Napa Valley, Napa, California, US",750 ml,White, US,5/1/2021,"
                      Richly brooding in soft, supple and lush texture and rich fruit, this offers bold flavors of apple, pear and Meyer lemon. From the heart of the appellation, it shows silky undertones of lemongrass and nutmeg, finding a core of spice and complexity buoyed by fresh acidity.                      Virginie Boone ",Huichica Hills,Duckhorn 2018 Huichica Hills Chardonnay (Napa Valley),$58, California,91, Napa,Napa Valley,Not rated yet [Add Your Review],Chardonnay,2018,Duckhorn
160,13.5%,"Walker Bay, South Africa",750 ml,White, South Africa,5/1/2021,"
                      White flower and a touch of fynbos dance atop the bouquet of this vibrant white, with a core of pink apple, white melon rind and orange peel. The palate is medium in weight, with crisp fruit tones and bright acidity that yield a crisp, refreshing package. Notes of sweet spice unfold on the back of the finish, which offers medium length and complexity. Drink now.                      Lauren Buzzeo ",,Creation 2019 Chardonnay (Walker Bay),$26,Walker Bay,91,,,Not rated yet [Add Your Review],Chardonnay,2019,Creation
161,13.5%,"Hemel-en-Aarde Ridge, South Africa",750 ml,White, South Africa,5/1/2021,"
                      This starts off surprisingly light in intensity on the nose, with faint hints of freshly dried straw, fresh apple slices and a touch of orange rind. The palate starts off with more of the same and is light upon entry, but then unveils a rounder midpalate and a creamy mouthfeel around flavors of creamed pear and baked apple that carry through to the close.                      Lauren Buzzeo ",,Cap Maritime 2018 Chardonnay (Hemel-en-Aarde Ridge),$54,Hemel-en-Aarde Ridge,90,,,Not rated yet [Add Your Review],Chardonnay,2018,Cap Maritime
162,13.5%,"Hemel-en-Aarde Ridge, South Africa",750 ml,White, South Africa,5/1/2021,"
                      This starts off surprisingly light in intensity on the nose, with faint hints of freshly dried straw, fresh apple slices and a touch of orange rind. The palate starts off with more of the same and is light upon entry, but then unveils a rounder midpalate and a creamy mouthfeel around flavors of creamed pear and baked apple that carry through to the close.                      Lauren Buzzeo ",,Cap Maritime 2018 Chardonnay (Hemel-en-Aarde Ridge),$54,Hemel-en-Aarde Ridge,90,,,Not rated yet [Add Your Review],Chardonnay,2018,Cap Maritime
163,14.5%,"Sta. Rita Hills, Central Coast, California, US",750 ml,White, US,5/1/2021,"
                      Toasty aromas of hazelnut and macadamia nut meet with sightly scorched lemon-butter scents on the nose of this bottling. Slightly tangy lime, lemon and grapefruit flavors show on the sip, with is very pithy in texture.                      Matt Kettmann ",Gnesa Vineyard,Spear 2018 Gnesa Vineyard Chardonnay (Sta. Rita Hills),$45, California,90, Central Coast,Sta. Rita Hills,Not rated yet [Add Your Review],Chardonnay,2018,Spear
164,14.1%,"Carneros, Napa-Sonoma, California, US",750 ml,White, US,5/1/2021,"
                      Steely and floral, with an underlying minerality of wet stone, this cool-climate white is restrained in nature. The fruit is a mix of green apple, pear and mango, with a finish of subtle baking spice.                      Virginie Boone ",,Ziata 2018 Chardonnay (Carneros),$55, California,90, Napa-Sonoma,Carneros,Not rated yet [Add Your Review],Chardonnay,2018,Ziata
165,13.8%,"Lake County, Lake County, California, US",750 ml,White, US,5/1/2021,"
                      Although full in body, this richly textured wine keeps its flavors and mouthfeel in good balance. Tangy acidity and ripe pear and apple flavors join light butter and baking-spice notes that demand further sipping.                      Jim Gordon ",High Elevation Collection,Shannon Ridge 2019 High Elevation Collection Chardonnay (Lake County),$23, California,90, Lake County,Lake County,Not rated yet [Add Your Review],Chardonnay,2019,Shannon Ridge
166,14.5%,"California, California Other, California, US",750 ml,White, US,5/1/2021,"
                      An unusually deep gold color and almost pungent aromas of browned butter and toasted hazelnuts lead to a rich, nutty, salty sensation on the palate and indulgent butterscotch flavors. It's an extreme, uninhibited wine that is ultraflavorful.                      Jim Gordon ",Theo-patra's Cuvée Blanc,Theopolis 2017 Theo-patra's Cuvée Blanc Chardonnay (California),$25, California,90, California Other,California,Not rated yet [Add Your Review],Chardonnay,2017,Theopolis
167,14.4%,"Santa Maria Valley, Central Coast, California, US",750 ml,White, US,5/1/2021,"
                      Creamy aromas of butter and salted almonds show on the nose of this appellation blend. There is a decent grip on the sip, which frames the very strong lactic notes of butterscotch, caramel and browned butter, with baked apple providing the fruit note.                      Matt Kettmann ",,Brophy Clark 2017 Chardonnay (Santa Maria Valley),$30, California,90, Central Coast,Santa Maria Valley,Not rated yet [Add Your Review],Chardonnay,2017,Brophy Clark
168,14.4%,"Santa Maria Valley, Central Coast, California, US",750 ml,White, US,5/1/2021,"
                      Creamy aromas of butter and salted almonds show on the nose of this appellation blend. There is a decent grip on the sip, which frames the very strong lactic notes of butterscotch, caramel and browned butter, with baked apple providing the fruit note.                      Matt Kettmann ",,Brophy Clark 2017 Chardonnay (Santa Maria Valley),$30, California,90, Central Coast,Santa Maria Valley,Not rated yet [Add Your Review],Chardonnay,2017,Brophy Clark
169,14.5%,"Sta. Rita Hills, Central Coast, California, US",750 ml,White, US,5/1/2021,"
                      Ripe honeydew, guava and light coconut-flake aromas make for a very broad and open nose for this stainless bottling from own-rooted vines. The palate is more tense in structure, with citrus-juice flavors cutting into the tropical guava notes.                      Matt Kettmann ",Gnesa Stainless,Spear 2019 Gnesa Stainless Chardonnay (Sta. Rita Hills),$60, California,90, Central Coast,Sta. Rita Hills,Not rated yet [Add Your Review],Chardonnay,2019,Spear
170,14.1%,"Santa Cruz Mountains, Central Coast, California, US",750 ml,White, US,5/1/2021,"
                      Grapefruit peel, chiseled stone, light jasmine and hints of guava show on the nose of this bottling. Linear flavors of lime peel and lemon pith are framed by a white-stone minerality on the palate.                      Matt Kettmann ",,Cinnabar 2019 Chardonnay (Santa Cruz Mountains),$39, California,90, Central Coast,Santa Cruz Mountains,Not rated yet [Add Your Review],Chardonnay,2019,Cinnabar
171,12.5%,"Central Coast, Central Coast, California, US",750 ml,White, US,5/1/2021,"
                      Restrained on the nose, this bottling offers citrus peel and pith, with tight alkaline and dried earth aromas. There is a clean, chalky grip to the sip, where the baking-soda-like minerality frames white fleshed fruit and more citrus-pith flavors.                      Matt Kettmann ",,Myka 2019 Chardonnay (Central Coast),$28, California,90, Central Coast,Central Coast,Not rated yet [Add Your Review],Chardonnay,2019,Myka
172,13.4%,"Columbia Valley (WA), Columbia Valley, Washington, US",750 ml,White, US,5/1/2021,"
                      With its pale golden hue, this wine has aromas of yellow apple, pineapple and Bosc pear. The palate is direct and lightly creamy, with a pleasing acidic lift. The balance is impressive throughout.                      Sean P. Sullivan ",,Alki 2019 Chardonnay (Columbia Valley (WA)),$20, Washington,90, Columbia Valley,Columbia Valley (WA),Not rated yet [Add Your Review],Chardonnay,2019,Alki
173,14.1%,"Napa Valley, Napa, California, US",750 ml,White, US,5/1/2021,"
                      Fermented primarily in stainless steel, this is a broadly appealing white wine that is lengthy in baking-spice and fruity overtones of caramel apple and fig. Fleshy and moderately rich, it offers a supple texture that endures and will please a wide range of palates.                      Virginie Boone ",Estate Grown,Hess Collection 2018 Estate Grown Chardonnay (Napa Valley),$22, California,90, Napa,Napa Valley,Not rated yet [Add Your Review],Chardonnay,2018,Hess Collection
174,13.8%,"Yakima Valley, Columbia Valley, Washington, US",750 ml,White, US,5/1/2021,"
                      This site has proved itself again and again to be a special spot for this variety as it does here. Aromas of toast, crayon and clarified butter lead creamy, well-balanced fruit flavors. It's an enjoyable example of a creamy style.                      Sean P. Sullivan ",Sur Lie Olsen Vineyard,Basel Cellars 2019 Sur Lie Olsen Vineyard Chardonnay (Yakima Valley),$36, Washington,90, Columbia Valley,Yakima Valley,Not rated yet [Add Your Review],Chardonnay,2019,Basel Cellars
175,14.8%,"Napa Valley, Napa, California, US",750 ml,White, US,5/1/2021,"
                      Made in a sizably opulent and robust style, this concentrated wine is richly layered in baked pear, vanilla and toasted oak. Textured and weighty, it delivers memorable intensity and lasting flavor.                      Virginie Boone ",Private Reserve,Beringer 2018 Private Reserve Chardonnay (Napa Valley),$45, California,90, Napa,Napa Valley,Not rated yet [Add Your Review],Chardonnay,2018,Beringer
176,14.1%,"Petaluma Gap, Sonoma, California, US",750 ml,White, US,5/1/2021,"
                      This wine opens in a touch of matchstick before finding its groove on the midpalate. It is bright and crisp in acidity and with sharp flavors of green apple and quince.                      Virginie Boone ",,Thirty-Seven 2018 Chardonnay (Petaluma Gap),$24, California,90, Sonoma,Petaluma Gap,Not rated yet [Add Your Review],Chardonnay,2018,Thirty-Seven
177,14.5%,"Horse Heaven Hills, Columbia Valley, Washington, US",750 ml,White, US,5/1/2021,"
                      Aromas of peach, straw and sweet spice lead to stone fruit flavors that are rich in the center. Like many wines from this vintage, its appeal is much about the balance it brings.                      Sean P. Sullivan ",Canoe Ridge Estate,Chateau Ste. Michelle 2018 Canoe Ridge Estate Chardonnay (Horse Heaven Hills),$20, Washington,90, Columbia Valley,Horse Heaven Hills,Not rated yet [Add Your Review],Chardonnay,2018,Chateau Ste. Michelle
178,14.1%,"Edna Valley, Central Coast, California, US",750 ml,White, US,5/1/2021,"
                      Clean lines of white melon, white peach, pineapple, sea salt and toast burst from the nose of this bottling. It's broad and ripe on the palate with strong stone-fruit flavors, as an underlying acidity and subtle tension holds those richer aspects intact.                      Matt Kettmann ",,Hitch 2019 Chardonnay (Edna Valley),$20, California,89, Central Coast,Edna Valley,Not rated yet [Add Your Review],Chardonnay,2019,Hitch
