,Alcohol,Appellation,Bottle Size,Category,Country,Date Published,Description,Designation,Name,Price,Province,Rating,Region,Subregion,User Avg Rating,Variety,Vintage,Winery
267,13.5%,"Collio, Northeastern Italy, Italy",750 ml,White, Italy,10/1/2020,"
                      Inviting aromas of grapefruit, hay, white stone fruit and thyme lead the nose. The aromas carry on to the savory, elegant palate along with yellow pear and tangy saline. Fresh acidity keeps it balanced and tense.                      Kerin O’Keefe ",,Primosic 2019 Friulano (Collio),$18, Northeastern Italy,92,Collio,,Not rated yet [Add Your Review],"Friulano, Italian White",2019,Primosic
268,13.5%,"Carso, Northeastern Italy, Italy",750 ml,White, Italy,10/1/2020,"
                      Enticing scents of botanical herb, wet stone, geranium and orchard fruit lift out of the glass. Savory and fresh, the focused palate doles out ripe pear, apple and lemon thyme before a tangy, flinty mineral finish. It's made with organically farmed grapes.                      Kerin O’Keefe ",,Castelvecchio 2019 Malvasia (Carso),$23, Northeastern Italy,92,Carso,,Not rated yet [Add Your Review],"Malvasia, Italian White",2019,Castelvecchio
269,12.3%,"Columbia Gorge (WA), Washington Other, Washington, US",750 ml,White, US,10/1/2020,"
                      This is a new variety within the state, and what a debut. All fermented in neutral oak, fresh aromas of pear, tangerine, mineral, citrus and flower yield exquisitely pure flavors, with high-wire lemony acidity connecting it all together. A gorgeous wine, its sense of vibrancy separates it.                      Sean P. Sullivan ",Cor Estate Vineyard,Ago 2019 Cor Estate Vineyard Tocai Friulano (Columbia Gorge (WA)),$32, Washington,92, Washington Other,Columbia Gorge (WA),Not rated yet [Add Your Review],"Tocai Friulano, Italian White",2019,Ago
270,13%,"Collio, Northeastern Italy, Italy",750 ml,White, Italy,10/1/2020,"
                      Aromas of hazelnut, acacia flower, honey and white stone fruit shape the nose on this elegant white. On the savory, focused palate, bright acidity accompanies mature Bartlett pear, botanical herb and a hint of graphite before an almond finish.                      Kerin O’Keefe ",,Schiopetto 2018 Friulano (Collio),$30, Northeastern Italy,92,Collio,,Not rated yet [Add Your Review],"Friulano, Italian White",2018,Schiopetto
271,12.5%,,750 ml,White,,10/1/2020,"
                      This radiant white opens with heady aromas of spring blossoms, pear, exotic fruits and a delicate whisper of Mediterranean scrub. It's smooth and savory, featuring Rennet apple, white peach and Meyer lemon alongside crisp acidity. A saline note further energizes the finish.                      Kerin O’Keefe ",Variety,Di Meo 2018 G  (Greco di Tufo),$28,,92,,,Not rated yet [Add Your Review],,2018,
272,12.3%,"Columbia Gorge (WA), Washington Other, Washington, US",750 ml,White, US,10/1/2020,"
                      This is a new variety within the state, and what a debut. All fermented in neutral oak, fresh aromas of pear, tangerine, mineral, citrus and flower yield exquisitely pure flavors, with high-wire lemony acidity connecting it all together. A gorgeous wine, its sense of vibrancy separates it.                      Sean P. Sullivan ",Cor Estate Vineyard,Ago 2019 Cor Estate Vineyard Tocai Friulano (Columbia Gorge (WA)),$32, Washington,92, Washington Other,Columbia Gorge (WA),Not rated yet [Add Your Review],"Tocai Friulano, Italian White",2019,Ago
273,12.5%,"Fiano di Avellino, Southern Italy, Italy",750 ml,White, Italy,10/1/2020,"
                      Mediterranean herb, white stone fruit and citrus aromas mingle with a whiff of wet stone. Linear and racy, the chiseled palate shows Bartlett pear, Meyer lemon and hazelnut alongside vibrant acidity. A flinty mineral further energizes the finish.                      Kerin O’Keefe ",Satrano,Villa Raiano 2018 Satrano  (Fiano di Avellino),$36, Southern Italy,92,Fiano di Avellino,,Not rated yet [Add Your Review],"Fiano, Italian White",2018,Villa Raiano
274,13%,"Greco di Tufo, Southern Italy, Italy",750 ml,White, Italy,10/1/2020,"
                      Eucalyptus, citrus and freshly baked bread aromas waft out of the glass. It's tangy, savory and elegant, featuring flavors of green melon, Meyer lemon, saline and wild herb set against racy acidity.                      Kerin O’Keefe ",Vigna Serrone,Cantine di Marzo 2018 Vigna Serrone  (Greco di Tufo),$28, Southern Italy,92,Greco di Tufo,,Not rated yet [Add Your Review],"Greco, Italian White",2018,Cantine di Marzo
275,13%,"Collio, Northeastern Italy, Italy",750 ml,White, Italy,10/1/2020,"
                      Fresh and medium bodied, this has delicate scents of white stone fruit and spring flowers. On the juicy palate, fresh acidity lifts ripe pear, apple, white peach and fennel before finishing on a tangy mineral note suggesting oyster shell.                      Kerin O’Keefe ",Raiante,Conti Formentini 2019 Raiante Ribolla Gialla (Collio),$18, Northeastern Italy,91,Collio,,Not rated yet [Add Your Review],"Ribolla Gialla, Italian White",2019,Conti Formentini
276,11%,"Puglia, Southern Italy, Italy",750 ml,White, Italy,10/1/2020,"
                      A slightly hazy hue of burnt orange, this natural-leaning white offers a playful nose of peach and apricot juice, alongside lifted elements of orange and dried spring flowers. It's tangy and grippy on the palate, showing lots of fruit skin flavors that are filled out by a vein of juicy acidity. A smoky oolong tea note extends on the finish.                      Alexander Peartree ",Cosi Comé,Valentina Passalacqua 2018 Cosi Comé Greco (Puglia),$28, Southern Italy,91,Puglia,,Not rated yet [Add Your Review],"Greco, Italian White",2018,Valentina Passalacqua
277,13%,"Collio, Northeastern Italy, Italy",750 ml,White, Italy,10/1/2020,"
                      Fresh and medium bodied, this has delicate scents of white stone fruit and spring flowers. On the juicy palate, fresh acidity lifts ripe pear, apple, white peach and fennel before finishing on a tangy mineral note suggesting oyster shell.                      Kerin O’Keefe ",Raiante,Conti Formentini 2019 Raiante Ribolla Gialla (Collio),$18, Northeastern Italy,91,Collio,,Not rated yet [Add Your Review],"Ribolla Gialla, Italian White",2019,Conti Formentini
278,12.5%,,750 ml,White,,10/1/2020,"
                      Spring blossom and white stone fruit aromas form the delicate nose along with a whiff of wet stone. Racy and focused, the palate delivers ripe yellow pear, hazelnut, citrus and smoky flint alongside bright acidity and mineral tension.                      Kerin O’Keefe ",Variety,Di Meo 2018 F  (Fiano di Avellino),$28,,91,,,Not rated yet [Add Your Review],,2018,
279,12.5%,,750 ml,White,,10/1/2020,"
                      Acacia flower, yellow peach, pear and citrus aromas mingle together. Tangy and linear, the palate offers apricot, honey, hazelnut and a lemon drop candy note alongside fresh acidity.                      Kerin O’Keefe ",Variety,Di Meo 2019 F  (Fiano di Avellino),$28,,91,,,Not rated yet [Add Your Review],,2019,
280,13%,"Adelaida District, Central Coast, California, US",750 ml,White, US,10/1/2020,"
                      A slightly dark shade of yellow in the glass, this bottling of a grape that's rare in California shows aromas of lemon peel, beeswax and toasted nuts. The texture is rich and waxy on the palate, where orange-peel, yellow-apple and more toasted nut flavors arise.                      Matt Kettmann ",Luna Matta Vineyard,Villa Creek 2017 Luna Matta Vineyard Fiano (Adelaida District),$50, California,91, Central Coast,Adelaida District,Not rated yet [Add Your Review],"Fiano, Italian White",2017,Villa Creek
281,14%,"Collio, Northeastern Italy, Italy",750 ml,White, Italy,10/1/2020,"
                      Aromas of yellow stone fruit, Alpine herb and wet stone shape the nose. Reflecting the aromas, the medium-bodied, rounded palate offers peach, yellow apple and mature grapefruit before a flinty finish. Tangy acidity keeps it juicy.                      Kerin O’Keefe ",,Ronco dei Tassi 2019 Malvasia (Collio),$28, Northeastern Italy,91,Collio,,Not rated yet [Add Your Review],"Malvasia, Italian White",2019,Ronco dei Tassi
282,13%,"Greco di Tufo, Southern Italy, Italy",750 ml,White, Italy,10/1/2020,"
                      Wild herb, mature white stone fruit and citrus aromas come together in the glass along with the barest whiffs of exotic fruit and just baked bread. Racy and refined, the linear palate doles out Meyer lemon, green melon and saline alongside vibrant acidity.                      Kerin O’Keefe ",Vigna Ortale,Cantine di Marzo 2018 Vigna Ortale  (Greco di Tufo),$28, Southern Italy,91,Greco di Tufo,,Not rated yet [Add Your Review],"Greco, Italian White",2018,Cantine di Marzo
283,13%,"Lugana, Lombardy, Italy",750 ml,White, Italy,10/1/2020,"
                      Aromas of mature pear, citrus and white spring flowers form the delicately enticing nose. The savory palate offers gooseberry, white peach and juicy grapefruit alongside tangy acidity. It closes on a white almond note.                      Kerin O’Keefe ",I Frati,Cà dei Frati 2019 I Frati  (Lugana),$20, Lombardy,91,Lugana,,Not rated yet [Add Your Review],"Turbiana, Italian White",2019,Cà dei Frati
284,13%,"Collio, Northeastern Italy, Italy",750 ml,White, Italy,10/1/2020,"
                      Delicate aromas of spring field flowers and white stone fruit form the nose along with whiffs of chamomile and nut. Reflecting the aromas, the round palate offers ripe Bartlett pear, yellow apple and a hint of grapefruit alongside tangy acidity. A bitter almond note signals the close.                      Kerin O’Keefe ",Primarul,Venica & Venica 2019 Primarul Friulano (Collio),$26, Northeastern Italy,91,Collio,,Not rated yet [Add Your Review],"Friulano, Italian White",2019,Venica & Venica
285,13.5%,"Lugana, Lombardy, Italy",750 ml,White, Italy,10/1/2020,"
                      Mature yellow stone fruit, toasted hazelnut and dried herb aromas lead the nose along with a whiff of honey. The round, enveloping palate offers ripe yellow peach and lemon drop candy before a honeyed almond close.                      Kerin O’Keefe ",Riserva,Le Morette 2017 Riserva  (Lugana),$35, Lombardy,91,Lugana,,Not rated yet [Add Your Review],"Turbiana, Italian White",2017,Le Morette
286,13%,"Soave, Veneto, Italy",750 ml,White, Italy,10/1/2020,"
                      Subtle aromas of spring blossoms and yellow stone fruit escape the glass. On the enveloping, medium-bodied palate, fresh acidity lifts ripe peach, apricot and tangy lemon drop candy before closing on a savory saline note.                      Kerin O’Keefe ",Recorbian,Franchetto 2017 Recorbian  (Soave),$21, Veneto,91,Soave,,Not rated yet [Add Your Review],"Garganega, Italian White",2017,Franchetto
287,12.5%,"Collio, Northeastern Italy, Italy",750 ml,White, Italy,10/1/2020,"
                      Aromas of spring blossoms and white stone fruit form the nose along with a whiff of cantaloupe. Linear and racy, the palate offers ripe pear, lemon drop candy and a hint of hazelnut alongside vibrant acidity.                      Kerin O’Keefe ",,Gradis'ciutta 2018 Friulano (Collio),$22, Northeastern Italy,91,Collio,,Not rated yet [Add Your Review],"Friulano, Italian White",2018,Gradis'ciutta
288,13%,"Collio, Northeastern Italy, Italy",750 ml,White, Italy,10/1/2020,"
                      Aromas of yellow stone fruit, spring wildflower and Alpine herb lead the nose. Elegant and linear, the vibrant, savory palate offers yellow peach, apricot and a hint of graphite alongside bright acidity. It closes on an almond note.                      Kerin O’Keefe ",,Borgo Conventi 2018 Friulano (Collio),$19, Northeastern Italy,91,Collio,,Not rated yet [Add Your Review],"Friulano, Italian White",2018,Borgo Conventi
289,14%,"Collio, Northeastern Italy, Italy",750 ml,White, Italy,10/1/2020,"
                      Aromas of yellow apple, spring blossoms and grapefruit form the delicate nose. The aromas follow over to the savory, structured palate along with lemon drop candy, orange zest and a hint of ginger. Vibrant acidity brightens the rich flavors.                      Kerin O’Keefe ",Manditocai,Livon 2018 Manditocai Friulano (Collio),$40, Northeastern Italy,91,Collio,,Not rated yet [Add Your Review],"Friulano, Italian White",2018,Livon
290,12.5%,"Lugana, Lombardy, Italy",750 ml,Sparkling, Italy,10/1/2020,"
                      Aromas of bread crust and white stone form the inviting nose. On the bright, savory palate, tangy acidity accompanies ripe yellow apple, creamy Bartlett pear and hazelnut alongside an elegant perlage and fresh acidity.                      Kerin O’Keefe ",Metodo Classico Brut Hirundo,Selva Capuzza NV Metodo Classico Brut Hirundo  (Lugana),$30, Lombardy,91,Lugana,,Not rated yet [Add Your Review],"Turbiana, Italian White",,Selva Capuzza
291,12.5%,"Collio, Northeastern Italy, Italy",750 ml,White, Italy,10/1/2020,"
                      Lovely aromas of white spring flowers mingle with pear and a whiff of freshly baked bread. Racy and elegant, the savory palate offers ripe apple, white peach and citrusy notes alongside vibrant acidity. It has a crisp, pristine close.                      Kerin O’Keefe ",Sodevo,Zuani 2018 Sodevo Ribolla Gialla (Collio),$19, Northeastern Italy,91,Collio,,Not rated yet [Add Your Review],"Ribolla Gialla, Italian White",2018,Zuani
292,13.5%,"Salento, Southern Italy, Italy",750 ml,White, Italy,10/1/2020,"
                      Rich aromas of melon and apple meld with white blossoms on the nose. This is playful and fruity on the palate in juicy tones of apricot skins and pineapple, while a gentle grip of white tea and tangy acidity keep it all buttoned up.                      Alexander Peartree ",Askos,Masseria Li Veli 2019 Askos Verdeca (Salento),$21, Southern Italy,90,Salento,,Not rated yet [Add Your Review],"Verdeca, Italian White",2019,Masseria Li Veli
293,13%,"Collio, Northeastern Italy, Italy",750 ml,White, Italy,10/1/2020,"
                      Yellow spring flower, Meyer lemon and white stone fruit aromas form the delicate nose along with a whiff of thyme. On the savory, vibrant palate, hazelnut and bread dough notes accent ripe yellow pear and white peach before a tangy mineral close suggesting briny oyster shell.                      Kerin O’Keefe ",,Schiopetto 2018 Malvasia (Collio),$30, Northeastern Italy,90,Collio,,Not rated yet [Add Your Review],"Malvasia, Italian White",2018,Schiopetto
294,13.5%,"Lugana, Lombardy, Italy",750 ml,White, Italy,10/1/2020,"
                      Lightly scented, this opens with whiffs of toasted hazelnut, beeswax and yellow apple. On the palate, hints of bitter almond and a dollop of vanilla accent ripe pear and white peach. Fresh acidity lifts the finish.                      Kerin O’Keefe ",Menasso Riserva,Selva Capuzza 2016 Menasso Riserva  (Lugana),$30, Lombardy,90,Lugana,,Not rated yet [Add Your Review],"Turbiana, Italian White",2016,Selva Capuzza
295,13.5%,"Collio, Northeastern Italy, Italy",750 ml,White, Italy,10/1/2020,"
                      Aromas of mature yellow stone fruit, grapefruit and beeswax mingle together in the glass. Mirroring the nose, the medium-bodied, savory palate features ripe apricot, peach and hazelnut before finishing on a honeyed note. Fresh acidity accompanies the rich flavors.                      Kerin O’Keefe ",,Vigna del Lauro 2019 Friulano (Collio),$22, Northeastern Italy,90,Collio,,Not rated yet [Add Your Review],"Friulano, Italian White",2019,Vigna del Lauro
296,13.5%,"Collio, Northeastern Italy, Italy",750 ml,White, Italy,10/1/2020,"
                      Hawthorn, hay and tomato leaf mingle with citrus aromas on this inviting, medium-bodied white. On the savory palate, notes of thyme, sage and fennel accent ripe yellow pear and lemon drop candy before a honeyed almond close. Fresh acidity keeps it bright and focused.                      Kerin O’Keefe ",,Conti Formentini 2019 Friulano (Collio),$18, Northeastern Italy,90,Collio,,Not rated yet [Add Your Review],"Friulano, Italian White",2019,Conti Formentini
297,13%,"Willamette Valley, Willamette Valley, Oregon, US",750 ml,White, US,10/1/2020,"
                      A relative of Sauvignon Blanc, this unusual grape has lovely floral highlights and plenty of tart citrus. The crunchy apple fruit is paired with tangy tangerine, and it adds up to a refreshing, acid-driven alternative to the more standard Willamette Valley whites.                      Paul Gregutt ",,Cooper Mountain 2019 Tocai Friulano (Willamette Valley),$25, Oregon,90, Willamette Valley,Willamette Valley,Not rated yet [Add Your Review],"Tocai Friulano, Italian White",2019,Cooper Mountain
298,12.5%,"Lugana, Lombardy, Italy",750 ml,White, Italy,10/1/2020,"
                      Enticing scents of spring blossoms, white stone fruit and citrus shape the delicate nose. Made with organic grapes, it's fresh, savory and understated, offering ripe yellow pear, grapefruit and bitter almond alongside tangy acidity.                      Kerin O’Keefe ",Organic,Perla del Garda 2019 Organic  (Lugana),N/A, Lombardy,90,Lugana,,Not rated yet [Add Your Review],"Turbiana, Italian White",2019,Perla del Garda
299,13.5%,"Collio, Northeastern Italy, Italy",750 ml,White, Italy,10/1/2020,"
                      Aromas of hay and tropical fruit mix with whiffs of elderflower and crushed tomato leaf. On the racy palate, crisp acidity accompanies juicy grapefruit, green melon and wild herb before a clean, dry close.                      Kerin O’Keefe ",,Ferruccio Sgubin 2018 Friulano (Collio),$20, Northeastern Italy,90,Collio,,Not rated yet [Add Your Review],"Friulano, Italian White",2018,Ferruccio Sgubin
300,13.5%,"Collio, Northeastern Italy, Italy",750 ml,White, Italy,10/1/2020,"
                      Enticing scents of yellow stone fruit, geranium and citrus form the delicate, alluring nose. On the savory, focused palate, racy acidity and energizing mineral accompany tangerine, lime zest and saline before a white almond close.                      Kerin O’Keefe ",,Ronco Blanchis 2019 Malvasia (Collio),$25, Northeastern Italy,90,Collio,,Not rated yet [Add Your Review],"Malvasia, Italian White",2019,Ronco Blanchis
301,12.5%,"Lugana, Lombardy, Italy",750 ml,White, Italy,10/1/2020,"
                      Spring wildflower and white stone fruit aromas form the delicate, alluring nose. On the bright, tangy palate, fresh acidity accompanies yellow apple and white peach before a bitter almond close.                      Kerin O’Keefe ",San Vigilio,Selva Capuzza 2019 San Vigilio  (Lugana),$19, Lombardy,90,Lugana,,Not rated yet [Add Your Review],"Turbiana, Italian White",2019,Selva Capuzza
302,13%,"Greco di Tufo, Southern Italy, Italy",750 ml,White, Italy,10/1/2020,"
                      Aromas of spring wildflowers and yellow stone fruit shape the nose along with a whiff of Mediterranean scrub. Crisp and savory, the racy palate offers yellow apple, Meyer lemon and tangy mineral notes evoking saline and briny oyster shell.                      Kerin O’Keefe ",,Cantine di Marzo 2019  Greco di Tufo,$21, Southern Italy,90,Greco di Tufo,,Not rated yet [Add Your Review],"Greco, Italian White",2019,Cantine di Marzo
303,13%,"Greco di Tufo, Southern Italy, Italy",750 ml,White, Italy,10/1/2020,"
                      Enticing aromas suggesting spring blossoms, white stone fruits and Mediterranean brush shape the nose along with a whiff of bread dough. Elegant and racy, the chiseled palate offers yellow pear, lemon thyme and briny oyster shell alongside brisk acidity.                      Kerin O’Keefe ",Vigna Laure,Cantine di Marzo 2018 Vigna Laure  (Greco di Tufo),$28, Southern Italy,90,Greco di Tufo,,Not rated yet [Add Your Review],"Greco, Italian White",2018,Cantine di Marzo
304,13%,"Collio, Northeastern Italy, Italy",750 ml,White, Italy,10/1/2020,"
                      Aromas of grapefruit and graphite interlace on the nose of this wine. On the savory, medium-bodied palate, a hint of honey accents ripe pear and bitter almond set against tangy acidity.                      Kerin O’Keefe ",,La Ponca 2018 Friulano (Collio),$25, Northeastern Italy,90,Collio,,Not rated yet [Add Your Review],"Friulano, Italian White",2018,La Ponca
305,14%,"Collio, Northeastern Italy, Italy",750 ml,White, Italy,10/1/2020,"
                      Fermented and aged in Slavonian oak, this fragrant, amber-colored wine opens with aromas of graphite, cedar, dried yellow stone fruit and saffron. The understated, structured palate shows elegance and restraint, featuring dried apricot, orange zest, saline and a sprinkling of ginger before a honeyed almond close. Fans of orange wine will love it.                      Kerin O’Keefe ",Ribolla di Oslavia Riserva,Primosic 2016 Ribolla di Oslavia Riserva Ribolla Gialla (Collio),$38, Northeastern Italy,90,Collio,,Not rated yet [Add Your Review],"Ribolla Gialla, Italian White",2016,Primosic
306,13%,"Venezia Giulia, Northeastern Italy, Italy",750 ml,White, Italy,10/1/2020,"
                      Lightly scented, this opens with delicate aromas of spring field flowers and white stone fruit. On the vibrant palate, crisp acidity accompanies ripe yellow pear, white peach and a hint of ginger.                      Kerin O’Keefe ",,Ronco dei Tassi 2019 Ribolla Gialla (Venezia Giulia),$28, Northeastern Italy,89,Venezia Giulia,,Not rated yet [Add Your Review],"Ribolla Gialla, Italian White",2019,Ronco dei Tassi
307,14%,"Collio, Northeastern Italy, Italy",750 ml,White, Italy,10/1/2020,"
                      Aromas of honey, acacia and cedar form the nose together with a whiff of summer orchard fruit. The racy, linear palate features mature yellow apple and toasted hazelnut alongside vibrant acidity. It closes on a tangy saline note.                      Kerin O’Keefe ",Collio,Ferruccio Sgubin 2016 Collio Friulano (Collio),$25, Northeastern Italy,89,Collio,,Not rated yet [Add Your Review],"Friulano, Italian White",2016,Ferruccio Sgubin
308,13%,"Collio, Northeastern Italy, Italy",750 ml,White, Italy,10/1/2020,"
                      Yellow spring wildflower, botanical herb and white stone fruit aromas lead the nose. On the racy palate, crisp acidity accompanies yellow apple and unsweetened lemon drop candy before closing on a hint of white almond.                      Kerin O’Keefe ",,La Rajade 2018 Ribolla Gialla (Collio),$18, Northeastern Italy,89,Collio,,Not rated yet [Add Your Review],"Ribolla Gialla, Italian White",2018,La Rajade
309,13%,"Fiano di Avellino, Southern Italy, Italy",750 ml,White, Italy,10/1/2020,"
                      This racy white has aromas reminiscent of exotic fruit, Mediterranean brush and citrus zest. On the crisp, linear palate, brisk acidity accompanies Bartlett pear, Meyer lemon and notes suggesting honeyed nut.                      Kerin O’Keefe ",,Cantine di Marzo 2019  Fiano di Avellino,$21, Southern Italy,89,Fiano di Avellino,,Not rated yet [Add Your Review],"Fiano, Italian White",2019,Cantine di Marzo
310,13%,"Collio, Northeastern Italy, Italy",750 ml,White, Italy,10/1/2020,"
                      Spring blossom, yellow apple and hazelnut aromas waft out of the glass. The aromas carry on to the vibrant, focused palate alongside yellow pear and a hint of Meyer lemon. It's crisp, with racy acidity.                      Kerin O’Keefe ",,Ferruccio Sgubin 2018 Ribolla Gialla (Collio),$20, Northeastern Italy,89,Collio,,Not rated yet [Add Your Review],"Ribolla Gialla, Italian White",2018,Ferruccio Sgubin
311,13%,"Collio, Northeastern Italy, Italy",750 ml,White, Italy,10/1/2020,"
                      Graphite, acacia, hazelnut and honey aromas follow over to the focused palate together with ripe apricot, bitter almond and a hint of grapefruit. Vibrant acidity provides the setting.                      Kerin O’Keefe ",,La Rajade 2018 Friulano (Collio),$18, Northeastern Italy,89,Collio,,Not rated yet [Add Your Review],"Friulano, Italian White",2018,La Rajade
312,10%,"Puglia, Southern Italy, Italy",750 ml,White, Italy,10/1/2020,"
                      A hazy color of sunset orange, this lively white starts off on aromas of apple, peach and tangerine, with blossomy white flowers joining in. It's tangy and racy on the palate, with textural flavors of apple and apricot skins that are elongated by a lingering oolong tea sensation. This is a great hands-off expression of the boisterous Bombino variety.                      Alexander Peartree ",Lux,Valentina Passalacqua 2018 Lux Bombino (Puglia),$28, Southern Italy,89,Puglia,,Not rated yet [Add Your Review],"Bombino, Italian White",2018,Valentina Passalacqua
313,12.5%,"Etna, Sicily & Sardinia, Italy",750 ml,White, Italy,10/1/2020,"
                      Linear and vibrant, this has delicate aromas of beeswax and hazelnut with a whiff of honey. On the racy, understated palate, smoky mineral accents Meyer lemon and yellow apple before a saline close.                      Kerin O’Keefe ",Crater,Monterosso 2017 Crater  (Etna),$40, Sicily & Sardinia,89,Etna,,Not rated yet [Add Your Review],"Carricante, Italian White",2017,Monterosso
314,12.5%,"Lugana, Lombardy, Italy",750 ml,White, Italy,10/1/2020,"
                      Subtle scents of beeswax and acacia flower shape the nose along with a whiff of honey. The aromas carry on to the palate along with ripe pear and white almond, all set against tangy acidity.                      Kerin O’Keefe ",Catulliano,Pratello 2019 Catulliano  (Lugana),$16, Lombardy,89,Lugana,,Not rated yet [Add Your Review],"Turbiana, Italian White",2019,Pratello
