,Alcohol,Appellation,Bottle Size,Category,Country,Date Published,Description,Designation,Name,Price,Province,Rating,Region,Subregion,User Avg Rating,Variety,Vintage,Winery
445,13.6%,"Russian River Valley, Sonoma, California, US",750 ml,White, US,3/1/2021,"
                      A soft, rounded white nicely layered in tropical and stone-fruit flavors, this is from a site planted in 1974 in the heart of the appellation. Bright and fleshy, it lingers in floral perfume and a touch of baking spice.                      Virginie Boone ",Lorenzo Vineyard,La Follette 2018 Lorenzo Vineyard Chardonnay (Russian River Valley),$50, California,93, Sonoma,Russian River Valley,Not rated yet [Add Your Review],Chardonnay,2018,La Follette
446,13.5%,"Dundee Hills, Willamette Valley, Oregon, US",750 ml,White, US,3/1/2021,"
                      Aged in neutral French puncheons, the emphasis is on the crystal-clear, bright and textured estate-grown fruit. Textured with crisp citrus and appealing minerality, this brings apple, citrus and fresh parsley flavors together in an exceptionally clean and sculpted wine.                      Paul Gregutt ",Estate,Lange 2019 Estate Chardonnay (Dundee Hills),$65, Oregon,93, Willamette Valley,Dundee Hills,Not rated yet [Add Your Review],Chardonnay,2019,Lange
447,12.5%,"Dundee Hills, Willamette Valley, Oregon, US",750 ml,White, US,3/1/2021,"
                      This puncheon-fermented wine has especially pure and deep fruit flavors reflecting a cluster of different varieties of apples, along with a gentle hint of cucumber. It's lightly spicy, and the oak influence (63% was new) comes out in a lovely, toasty finish.                      Paul Gregutt ",Elsie's,Stoller 2018 Elsie's Chardonnay (Dundee Hills),$65, Oregon,93, Willamette Valley,Dundee Hills,Not rated yet [Add Your Review],Chardonnay,2018,Stoller
448,14.1%,"Dundee Hills, Willamette Valley, Oregon, US",750 ml,White, US,3/1/2021,"
                      This estate-grown, barrel-fermented, reserve selection is full bodied and flush with highlights of toast and roasted cashews. There's a rich core of ripe peach and apricot, along with hints of tropical fruits such as papaya and guava. The acids bring a pleasant pineapple note.                      Paul Gregutt ",Récolte Grand Cru,Domaine Serene 2017 Récolte Grand Cru Chardonnay (Dundee Hills),$135, Oregon,93, Willamette Valley,Dundee Hills,Not rated yet [Add Your Review],Chardonnay,2017,Domaine Serene
449,14%,"Lodi, Central Valley, California, US",750 ml,White, US,3/1/2021,"
                      This well-balanced and wonderfully concentrated wine starts out quietly with subtle pear and baking spice aromas, then blossoms on the palate with expansive poached pear, honey and vanilla notes. It's rich in texture, full in body but lifted by good acidity.                      Jim Gordon ",,Oak Farm 2019 Chardonnay (Lodi),$19, California,92, Central Valley,Lodi,Not rated yet [Add Your Review],Chardonnay,2019,Oak Farm
450,13.7%,"Eola-Amity Hills, Willamette Valley, Oregon, US",750 ml,White, US,3/1/2021,"
                      Brisk apple and citrus fruit holds center court here, with a slender thread of freshly cut green bean running through. Fermentation in one-third new French oak barrels rounds out the natural herbaceousness and adds a touch of toast to the finish.                      Paul Gregutt ",,Archery Summit 2018 Chardonnay (Eola-Amity Hills),$48, Oregon,92, Willamette Valley,Eola-Amity Hills,Not rated yet [Add Your Review],Chardonnay,2018,Archery Summit
451,13.2%,"Russian River Valley, Sonoma, California, US",750 ml,White, US,3/1/2021,"
                      From the great site, this white is buttery and evocative of a vanilla cookie dusted in salt. Crushed rock, green apple and toasted oak add to the complex, savory mix. The wine is robust in bright flavor and subdued ripeness.                      Virginie Boone ",Ritchie Vineyard,Flanagan 2018 Ritchie Vineyard Chardonnay (Russian River Valley),$68, California,92, Sonoma,Russian River Valley,Not rated yet [Add Your Review],Chardonnay,2018,Flanagan
452,14.2%,"Mendocino County, Mendocino County, California, US",750 ml,White, US,3/1/2021,"
                      Alluring poached pear aromas and mouthfilling almond, pear and baking-spice flavors add up to an indulgent experience in this lush and full-bodied wine. Made from fruit from a steep hillside vineyard, it's been aging especially long in the cellar.                      Jim Gordon ",Alder Springs Vineyard,Scout & Grange 2016 Alder Springs Vineyard Chardonnay (Mendocino County),$40, California,92, Mendocino County,Mendocino County,Not rated yet [Add Your Review],Chardonnay,2016,Scout & Grange
453,13.6%,"Arroyo Grande Valley, Central Coast, California, US",750 ml,White, US,3/1/2021,"
                      Subtle hints of macadamia nut, baked lemon meringue, butter and sea salt are presented in a mellow, subtle manner on the nose of this bottling, which would make a pleasant apéritif for any gathering. There's a taut frame to the sip, where lemon peel and lychee meet with a kiss of oak and a pinch of nutmeg.                      Matt Kettmann ",,Talley 2018 Chardonnay (Arroyo Grande Valley),$34, California,92, Central Coast,Arroyo Grande Valley,Not rated yet [Add Your Review],Chardonnay,2018,Talley
454,13.5%,"Burgenland, Austria",750 ml,White, Austria,3/1/2021,"
                      Vanilla, smoke and hazelnut make for a toasty aroma on the mellow, smooth nose. Underneath that lurk slightly funkier notions of yeast, butter and apple peel. The palate is as creamy as the nose promised, as lactic as those buttery notes suggested, yet there is a freshness at the core. This ultrarich wine should appeal to lovers of oaked Chardonnay.                      Anne Krebiehl MW ",Golden Cut,Steindorfer 2017 Golden Cut Chardonnay (Burgenland),$55,Burgenland,92,,,Not rated yet [Add Your Review],Chardonnay,2017,Steindorfer
455,13.9%,"Arroyo Grande Valley, Central Coast, California, US",750 ml,White, US,3/1/2021,"
                      Delicate aromas of yellow apple, daffodil, lemon blossom and light butter show on the nose of this single-vineyard expression. Familiar and comforting on the palate, the wine lands softly, with poached orange, light butter and delicate oak flavors, leading into a more complex finish of chamomile and cashew.                      Matt Kettmann ",Rosemary's,Talley 2018 Rosemary's Chardonnay (Arroyo Grande Valley),$60, California,92, Central Coast,Arroyo Grande Valley,Not rated yet [Add Your Review],Chardonnay,2018,Talley
456,13.5%,"Burgenland, Austria",750 ml,White, Austria,3/1/2021,"
                      Vanilla, smoke and hazelnut make for a toasty aroma on the mellow, smooth nose. Underneath that lurk slightly funkier notions of yeast, butter and apple peel. The palate is as creamy as the nose promised, as lactic as those buttery notes suggested, yet there is a freshness at the core. This ultrarich wine should appeal to lovers of oaked Chardonnay.                      Anne Krebiehl MW ",Golden Cut,Steindorfer 2017 Golden Cut Chardonnay (Burgenland),$55,Burgenland,92,,,Not rated yet [Add Your Review],Chardonnay,2017,Steindorfer
457,13.9%,"Arroyo Grande Valley, Central Coast, California, US",750 ml,White, US,3/1/2021,"
                      Delicate aromas of yellow apple, daffodil, lemon blossom and light butter show on the nose of this single-vineyard expression. Familiar and comforting on the palate, the wine lands softly, with poached orange, light butter and delicate oak flavors, leading into a more complex finish of chamomile and cashew.                      Matt Kettmann ",Rosemary's,Talley 2018 Rosemary's Chardonnay (Arroyo Grande Valley),$60, California,92, Central Coast,Arroyo Grande Valley,Not rated yet [Add Your Review],Chardonnay,2018,Talley
458,13.5%,"Santa Ynez Valley, Central Coast, California, US",750 ml,White, US,3/1/2021,"
                      Macadamia nut and baked apple aromas meet with a hint of baking spice and a linear, steely minerality on the nose of this bottling. There's a grippy, rain-on-cement-like minerality and chalky texture to the palate, with lime skin and jasmine leading into a finish of vanilla bean.                      Matt Kettmann ",Sanford & Benedict Vineyard,Au Bon Climat 2018 Sanford & Benedict Vineyard Chardonnay (Santa Ynez Valley),$40, California,92, Central Coast,Santa Ynez Valley,Not rated yet [Add Your Review],Chardonnay,2018,Au Bon Climat
459,13.3%,"Willamette Valley, Willamette Valley, Oregon, US",750 ml,White, US,3/1/2021,"
                      Always a fine value, the latest Old Stones puts an emphasis on fresh, juicy citrus fruits, a hint of pineapple, and a compelling wet stone minerality. There's good definition throughout, and the flavors cut a clean swath across the palate and down through a finish, hinting lightly at barrel toast.                      Paul Gregutt ",Old Stones,Bergström 2018 Old Stones Chardonnay (Willamette Valley),$40, Oregon,92, Willamette Valley,Willamette Valley,Not rated yet [Add Your Review],Chardonnay,2018,Bergström
460,14.4%,"Santa Lucia Highlands, Central Coast, California, US",750 ml,White, US,3/1/2021,"
                      Very showy aromas of tart lime deftly slice into the salted butter, baked pear and cinnamon spice on the nose of this bottling, which manages to be zesty while carrying the region's typical richness. The palate is tense with citrus pith texture, offering singed nectarine, apricot and salted Meyer lemon-rind flavors.                      Matt Kettmann ",Stainless Steel Fermented,Boekenoogen 2018 Stainless Steel Fermented Chardonnay (Santa Lucia Highlands),$38, California,92, Central Coast,Santa Lucia Highlands,Not rated yet [Add Your Review],Chardonnay,2018,Boekenoogen
461,14.5%,"Sonoma Coast, Sonoma, California, US",750 ml,White, US,3/1/2021,"
                      Floral and mineral-driven, this coastal wine delivers a stoniness of green apple and pear—crisp, defined flavors that lead to a complementary spread of brioche and toasted oak. Hearty and rich, it has balance and concentration.                      Virginie Boone ",,Patz & Hall 2018 Chardonnay (Sonoma Coast),N/A, California,92, Sonoma,Sonoma Coast,Not rated yet [Add Your Review],Chardonnay,2018,Patz & Hall
462,14%,"Washington, Washington Other, Washington, US",750 ml,White, US,3/1/2021,"
                      This wine is mostly estate fruit, along with a dash (13%) from Celilo Vineyard's 1980 plantings. The aromas pull you in, with notes of pear, yellow apple, star fruit and kisses of pineapple and spice, showing an appealing purity. The palate has concentration and richness, but also exquisite balance and dexterity. Lemony notes persist on the finish. The acid balance is spot on, and as always with this producer, it's all about grace and subtlety. Give it some additional time in bottle to see it at its best.                      Sean P. Sullivan ",,Woodward Canyon 2019 Chardonnay (Washington),$44, Washington,92, Washington Other,Washington,Not rated yet [Add Your Review],Chardonnay,2019,Woodward Canyon
463,14.5%,"Sonoma Coast, Sonoma, California, US",750 ml,White, US,3/1/2021,"
                      Floral and mineral-driven, this coastal wine delivers a stoniness of green apple and pear—crisp, defined flavors that lead to a complementary spread of brioche and toasted oak. Hearty and rich, it has balance and concentration.                      Virginie Boone ",,Patz & Hall 2018 Chardonnay (Sonoma Coast),N/A, California,92, Sonoma,Sonoma Coast,Not rated yet [Add Your Review],Chardonnay,2018,Patz & Hall
464,13.5%,"Santa Cruz Mountains, Central Coast, California, US",750 ml,White, US,3/1/2021,"
                      Sharp lime and grapefruit-peel aromas meet with warmer touches of nectarine and peach on the nose of this bottling, which also offers intriguing herb and earth scents. It's racy upon hitting the palate, full of lemon and orange-rind elements, as well as chalk and sea-salt warmth. The pithy texture carries deep into the finish.                      Matt Kettmann ",Lindsay Paige Vineyard,Alfaro Family 2018 Lindsay Paige Vineyard Chardonnay (Santa Cruz Mountains),$30, California,92, Central Coast,Santa Cruz Mountains,Not rated yet [Add Your Review],Chardonnay,2018,Alfaro Family
465,14.1%,"Eola-Amity Hills, Willamette Valley, Oregon, US",750 ml,White, US,3/1/2021,"
                      In this vintage, this wine reaches new heights of richness. It's a leesy, creamy mouthful, which touches broadly on banana-cream pie. It's a buttery palate-coater, underscored with wet rock minerality. As it fades away, the lingering impression is butter cookie. Yum!                      Paul Gregutt ",,Big Table Farm 2018 Chardonnay (Eola-Amity Hills),$48, Oregon,92, Willamette Valley,Eola-Amity Hills,Not rated yet [Add Your Review],Chardonnay,2018,Big Table Farm
466,13.1%,"Chehalem Mountains, Willamette Valley, Oregon, US",750 ml,White, US,3/1/2021,"
                      Fermented and aged in a single puncheon, this is packed with bright citrus fruit running through lemon, lime and grapefruit. Those forward, potent fruit flavors conjure up suggestions of Mountain Dew without the sugar, but there's much more going on in terms of depth and overall balance. It's nice counterpoint to the regular, stainless-fermented Chardonnay.                      Paul Gregutt ",Apollo,Vidon Vineyard 2018 Apollo Chardonnay (Chehalem Mountains),$60, Oregon,92, Willamette Valley,Chehalem Mountains,Not rated yet [Add Your Review],Chardonnay,2018,Vidon Vineyard
467,13.1%,"Chehalem Mountains, Willamette Valley, Oregon, US",750 ml,White, US,3/1/2021,"
                      This crisp and well-structured wine is replete with flavors of green apple and melon, backed with fresh, mineral-drenched acids. It's a perfect food wine—assertive yet malleable, with a balanced, sculpted mouthfeel and great penetration. It finishes with a lick of butterscotch as you reach to refill your glass.                      Paul Gregutt ",,Vidon Vineyard 2018 Chardonnay (Chehalem Mountains),$30, Oregon,92, Willamette Valley,Chehalem Mountains,Not rated yet [Add Your Review],Chardonnay,2018,Vidon Vineyard
468,13%,"Eola-Amity Hills, Willamette Valley, Oregon, US",750 ml,White, US,3/1/2021,"
                      Scents of flint, toast and cream open the door to a lovely wine centered around ripe and pretty nectarine fruit. Nicely focused and deep, the flavors show spicy wood highlights as well as a lingering finish which resolves in a wash of toasted hazelnuts. Credit 18 months in 30% new French oak.                      Paul Gregutt ",Estate,Bryn Mawr Vineyards 2017 Estate Chardonnay (Eola-Amity Hills),$40, Oregon,92, Willamette Valley,Eola-Amity Hills,Not rated yet [Add Your Review],Chardonnay,2017,Bryn Mawr Vineyards
469,13%,"Beaujolais Blanc, Beaujolais, France",750 ml,White, France,3/1/2021,"
                      This spicy, wood-aged wine is balanced and rich. Toastiness balances with green-plum and red-apple fruits to give a full-bodied, ripe wine that is ready to drink.                      Roger Voss ",Le Chêne du Châtelard,Domaine du Penlois 2018 Le Chêne du Châtelard  (Beaujolais Blanc),$37, Beaujolais,92,Beaujolais Blanc,,Not rated yet [Add Your Review],Chardonnay,2018,Domaine du Penlois
470,13.4%,"Yamhill-Carlton, Willamette Valley, Oregon, US",750 ml,White, US,3/1/2021,"
                      This lush wine is sourced from an estate vineyard and barrel fermented in neutral French oak. Sappy and sexy, it hits the palate with rich flavors of apple sauce and peach pie, along with accents of toasted hazelnuts. Despite the implied decadence, it's firmly anchored in vivid acids that keep it lively.                      Paul Gregutt ",Trovato Vineyard,Furioso 2018 Trovato Vineyard Chardonnay (Yamhill-Carlton),$48, Oregon,92, Willamette Valley,Yamhill-Carlton,Not rated yet [Add Your Review],Chardonnay,2018,Furioso
471,13.5%,"Sonoma County, Sonoma, California, US",750 ml,White, US,3/1/2021,"
                      Crisp, high-toned acidity lights the way to a fresh palate of lovely apple and pear notes in this layered, balanced and complex wine. Complementary oak spice seasons the fruit, adding a length of nutmeg and wild vanilla.                      Virginie Boone ",The Beauty of Three,Flanagan 2018 The Beauty of Three Chardonnay (Sonoma County),$28, California,92, Sonoma,Sonoma County,Not rated yet [Add Your Review],Chardonnay,2018,Flanagan
472,13.5%,"Willamette Valley, Willamette Valley, Oregon, US",750 ml,White, US,3/1/2021,"
                      Production has doubled on this excellent blend. It's loaded with tangy fruit flavors of peach, nectarine and green banana. Fermentation included 40% done in concrete, which brings some drying minerality, and the rest in a mix of new and neutral French oak, which helps to soften the profile. There's a nice touch of butter as the finish fades out.                      Paul Gregutt ",Three Hills Cuvée,Lange 2019 Three Hills Cuvée Chardonnay (Willamette Valley),$40, Oregon,92, Willamette Valley,Willamette Valley,Not rated yet [Add Your Review],Chardonnay,2019,Lange
473,13%,"Australia, Australia Other, Australia",750 ml,White, Australia,3/1/2021,"
                      This is a likable, multi-regional Chardonnay blend that is at first tightly reined and straightforward in nature, but reveals more layers as it opens in the glass. It weaves stone fruit, pineapple, salted nuts and toasty characters into a slippery, creamy mouthfeel. The oak is present but not overwhelming and an appealing salted peach note lingers on the finish. It's a solid example of modern Aussie Chardonnay.                      Christina Pickard ",Bin 311,Penfolds 2019 Bin 311 Chardonnay (Australia),$40, Australia Other,92,Australia,,Not rated yet [Add Your Review],Chardonnay,2019,Penfolds
474,13%,"Yarra Valley, Victoria, Australia",750 ml,White, Australia,3/1/2021,"
                      This premium Chardonnay is a classy bottling that emulates high-end Burgundy. Reductive at first, aromas of gun flint, salt and onion dominate. Eventually stone fruit squeaks through and more layers emerge with air and warmth. Polished, vanillin oak is present on the full-bodied palate, which offers a lovely texture and great fruit concentration. Drink 2021–2035.                      Christina Pickard ",Katherine's Paddock,Levantine Hill 2016 Katherine's Paddock Chardonnay (Yarra Valley),$85, Victoria,91,Yarra Valley,,Not rated yet [Add Your Review],Chardonnay,2016,Levantine Hill
475,13.2%,"Russian River Valley, Sonoma, California, US",750 ml,White, US,3/1/2021,"
                      Effusively bright and high-toned, this wine offers a demure imprint of oak on the nose. It then evolves to show complex contrasts of ginger, Meyer lemon and jasmine—an effectively cohesive, harmonious and lengthy expression of understated fruit.                      Virginie Boone ",Mirabelle Vineyard,MacRostie 2018 Mirabelle Vineyard Chardonnay (Russian River Valley),$46, California,91, Sonoma,Russian River Valley,Not rated yet [Add Your Review],Chardonnay,2018,MacRostie
476,12.6%,"Eola-Amity Hills, Willamette Valley, Oregon, US",750 ml,White, US,3/1/2021,"
                      This tangy wine was barrel fermented and aged in 18% new French oak. Juicy citrus, apple and peach fruit is well integrated, and a whiff of flint continues on into the finish. This has exceptional flavor and finesse for its price.                      Paul Gregutt ",Eola-Amity Hills,Bryn Mawr Vineyards 2018 Eola-Amity Hills Chardonnay (Eola-Amity Hills),$25, Oregon,91, Willamette Valley,Eola-Amity Hills,Not rated yet [Add Your Review],Chardonnay,2018,Bryn Mawr Vineyards
477,13.8%,"Oregon, Oregon Other, Oregon, US",750 ml,White, US,3/1/2021,"
                      The winery notes suggest piña colada as a principal flavor. There's pineapple fruit and maybe a hint of rum, along with green banana and melon. Separate lots were barrel-aged for a year and a half prior to blending, and a nice light touch of caramel comes out in the finished wine.                      Paul Gregutt ",Barrel Select Reserve,Eola Hills 2018 Barrel Select Reserve Chardonnay (Oregon),$25, Oregon,91, Oregon Other,Oregon,Not rated yet [Add Your Review],Chardonnay,2018,Eola Hills
478,13.2%,"Sonoma County, Sonoma, California, US",750 ml,White, US,3/1/2021,"
                      Made by Winemaker Leo Hansen from a majority of grapes grown at Stuhlmuller Vineyards, where the Alexander and Russian River valleys converge, this white is creamy and tropical, with lingering notes of stone fruit, vanilla and pear. Balanced acidity tempers the richness with ease and elegance.                      Virginie Boone ",,Stillman St. 2018 Chardonnay (Sonoma County),$17, California,91, Sonoma,Sonoma County,Not rated yet [Add Your Review],Chardonnay,2018,Stillman St.
479,13.6%,"Walla Walla Valley (WA), Columbia Valley, Washington, US",750 ml,White, US,3/1/2021,"
                      This Chardonnay saw no new oak and had minimal malolactic fermentation.  The aromas are all about subtlety with its notes of spice, apple and Bosc pear. The flavors are full of grace and balance, bringing vibrancy and freshness.                      Sean P. Sullivan ",Estate Vineyard,Woodward Canyon 2019 Estate Vineyard Chardonnay (Walla Walla Valley (WA)),$32, Washington,91, Columbia Valley,Walla Walla Valley (WA),Not rated yet [Add Your Review],Chardonnay,2019,Woodward Canyon
480,14%,"Russian River Valley, Sonoma, California, US",750 ml,White, US,3/1/2021,"
                      This wine has a great opening nose of apple and lemon, flavors that follow on the sleek midpalate. Spicy oak and dense concentration further define its charms—a balanced weightiness that provides texture and complexity.                      Virginie Boone ",Bacigalupi Vineyard,Flanagan 2018 Bacigalupi Vineyard Chardonnay (Russian River Valley),$68, California,91, Sonoma,Russian River Valley,Not rated yet [Add Your Review],Chardonnay,2018,Flanagan
481,13.5%,"Santa Maria Valley, Central Coast, California, US",750 ml,White, US,3/1/2021,"
                      Hazelnut, butter-poached lemon, squeezed mandarin and light macadamia nut aromas make for a wondrous nose on this bottling by Bob Lindquist. Yellow pear skins, grapefruit peels and a touch of guava show on the palate, which is pithy in texture.                      Matt Kettmann ",Bien Nacido Vineyard,Lindquist Family 2019 Bien Nacido Vineyard Chardonnay (Santa Maria Valley),$30, California,91, Central Coast,Santa Maria Valley,Not rated yet [Add Your Review],Chardonnay,2019,Lindquist Family
482,14%,"Mendocino County, Mendocino County, California, US",750 ml,White, US,3/1/2021,"
                      Rather subdued aromas are followed by zesty lemon and Bosc pear flavors in this full-bodied, lean but complex wine. While unoaked, it offers nuances of toasted almond on the palate along with hints of butter and vanilla, all carried by good acidity. Best through 2025.                      Jim Gordon ",Alder Springs Vineyard,Scout & Grange 2015 Alder Springs Vineyard Chardonnay (Mendocino County),$40, California,91, Mendocino County,Mendocino County,Not rated yet [Add Your Review],Chardonnay,2015,Scout & Grange
483,13.3%,"Napa Valley, Napa, California, US",750 ml,White, US,3/1/2021,"
                      A mineral-driven opening leads to a quiet, understated richness on the midpalate of this wine. Crisp and bright, as underlying acidity freshens layers of wet stone, pear and green apple, the oak is well integrated and in check.                      Virginie Boone ",,Textbook 2018 Chardonnay (Napa Valley),$27, California,91, Napa,Napa Valley,Not rated yet [Add Your Review],Chardonnay,2018,Textbook
484,13.1%,"Yarra Valley, Victoria, Australia",750 ml,White, Australia,3/1/2021,"
                      A relatively ripe, rich style of Chardonnay, this nevertheless delivers oodles of citrus, melon, salted nut, seashell and toasty, creamy oak. There's lovely, tingly acidity on the palate that buoys the creamy mouthfeel. It's a fruity but balanced wine, with length and crowd appeal.                      Christina Pickard ",Regional Selections,Handpicked 2017 Regional Selections Chardonnay (Yarra Valley),$25, Victoria,91,Yarra Valley,,Not rated yet [Add Your Review],Chardonnay,2017,Handpicked
485,12.8%,"Eola-Amity Hills, Willamette Valley, Oregon, US",750 ml,White, US,3/1/2021,"
                      This low abv but delicious wine paints a promising picture for future vintages of Project M Chardonnay. Buttery, lemony flavors are focused on apple and white-peach fruit, with a touch of thyme adding welcome herbal highlights.                      Paul Gregutt ",Annicca,Project M 2018 Annicca Chardonnay (Eola-Amity Hills),$38, Oregon,91, Willamette Valley,Eola-Amity Hills,Not rated yet [Add Your Review],Chardonnay,2018,Project M
486,14.2%,"Russian River Valley, Sonoma, California, US",750 ml,White, US,3/1/2021,"
                      From the long-standing grape grower's Goddard Ranch, on the westside of Westside Road, this rich, layered wine traffics in caramel, toasted apple and baked pineapple. Lush and opulent in style, it is rounded and rich, finishing in a moderate trace of acidity.                      Virginie Boone ",,Bacigalupi 2018 Chardonnay (Russian River Valley),$62, California,91, Sonoma,Russian River Valley,Not rated yet [Add Your Review],Chardonnay,2018,Bacigalupi
