,Alcohol,Appellation,Bottle Size,Category,Country,Date Published,Description,Designation,Name,Price,Province,Rating,Region,Subregion,User Avg Rating,Variety,Vintage,Winery
268,11.2%,"Anderson Valley, Mendocino County, California, US",750 ml,Sparkling, US,4/1/2021,"
                      This crisp, dry and toasty wine boasts bold, freshly baked bread aromas and lemon and butter flavors on a lively texture of tiny bubbles and brilliant acidity. It's a fun, bracing twist on tradition.                      Jim Gordon ",Lily's Pet Nat Sparkling,Donkey & Goat 2019 Lily's Pet Nat Sparkling Chardonnay (Anderson Valley),$35, California,92, Mendocino County,Anderson Valley,Not rated yet [Add Your Review],Chardonnay,2019,Donkey & Goat
269,15%,"Livermore Valley, Central Coast, California, US",750 ml,White, US,4/1/2021,"
                      This big, bold wine was made in a classic California reserve style, offering heady aromas of toasted oak and roasted walnuts, rich and deep Bosc pear flavors and a deliciously thick texture that helps carry it all through a lingering finish.                      Jim Gordon ",Landmark Collection,Rubino Estates Winery 2018 Landmark Collection Chardonnay (Livermore Valley),$40, California,92, Central Coast,Livermore Valley,Not rated yet [Add Your Review],Chardonnay,2018,Rubino Estates Winery
270,14.4%,"Sonoma Coast, Sonoma, California, US",750 ml,White, US,4/1/2021,"
                      Rich in an oak-driven layering of caramel crème brûlée and butterscotch, this wine is lengthy and lush on the palate, with a hearty soul balanced by underlying acidity. It shows coastal coolness and touches of baking spice and earthiness.                      Virginie Boone ",Panthera,Lion's Head 2018 Panthera Chardonnay (Sonoma Coast),$45, California,91, Sonoma,Sonoma Coast,Not rated yet [Add Your Review],Chardonnay,2018,Lion's Head
271,14.5%,"Russian River Valley, Sonoma, California, US",750 ml,White, US,4/1/2021,"
                      Floral and mineral-driven, this white is also robust in tropical and stone fruit, while being substantial in style and body weight. A note of honey adorns the palate and nose and emphasizes the viscous roundedness in the wine.                      Virginie Boone ",Kent Ritchie,MacRostie 2018 Kent Ritchie Chardonnay (Russian River Valley),$46, California,91, Sonoma,Russian River Valley,Not rated yet [Add Your Review],Chardonnay,2018,MacRostie
272,12.5%,"Trento, Northeastern Italy, Italy",750 ml,Sparkling, Italy,4/1/2021,"
                      Aromas of white spring flower, white orchard fruit and a whiff of brioche lead the way. On the crisp palate, an elegant perlage accompanies creamy yellow apple, pear and lemon drop.                      Kerin O’Keefe ",Brut,Ferrari NV Brut Chardonnay (Trento),$28, Northeastern Italy,91,Trento,,Not rated yet [Add Your Review],Chardonnay,,Ferrari
273,14%,"Napa Valley, Napa, California, US",750 ml,White, US,4/1/2021,"
                      An estate-grown wine given 15 months in French oak, 35% of it new, this is a rich and creamy expression of the grape, opening in a hit of cinnamon stick. A luxurious midpalate is highlighted in brioche, green apple and Meyer lemon, with a balanced take on both acidity and oak.                      Virginie Boone ",The Lioness,Hess 2018 The Lioness Chardonnay (Napa Valley),$65, California,91, Napa,Napa Valley,Not rated yet [Add Your Review],Chardonnay,2018,Hess
274,13.9%,"Carneros, Napa-Sonoma, California, US",750 ml,White, US,4/1/2021,"
                      Honeysuckle and lemongrass accent a steely core of wet stone, Meyer lemon and pear in this crisp, balanced vineyard-designate. As the core of fresh citrus builds, a contrasting note of butterscotch teases and adds lasting richness.                      Virginie Boone ",Sangiacomo Green Acres,Saintsbury 2018 Sangiacomo Green Acres Chardonnay (Carneros),$54, California,91, Napa-Sonoma,Carneros,Not rated yet [Add Your Review],Chardonnay,2018,Saintsbury
275,14.2%,"Santa Lucia Highlands, Central Coast, California, US",750 ml,White, US,4/1/2021,"
                      Pristine aromas of gardenia lead into salted orange slices, papaya, baked nectarine and yuzu spray on the nose of this bottling. There is a decent tightness to the palate, where mandarin-pith and peel flavors lead into riper peach by the finish.                      Matt Kettmann ",,Taraval 2019 Chardonnay (Santa Lucia Highlands),$18, California,91, Central Coast,Santa Lucia Highlands,Not rated yet [Add Your Review],Chardonnay,2019,Taraval
276,13%,"Finger Lakes, Finger Lakes, New York, US",750 ml,White, US,4/1/2021,"
                      Ripe lemon and yellow plum aromas are dotted with accents of sea spray, citrus cream and white blossoms in this Chardonnay, of which about a third sees time in French oak. The palate is creamy and concentrated in juicy yellow fruit, with ample lift from bright acidity and a seared lemon note that lingers on the close.                      Alexander Peartree ",,Trestle Thirty One 2017 Chardonnay (Finger Lakes),$32, New York,91, Finger Lakes,Finger Lakes,Not rated yet [Add Your Review],Chardonnay,2017,Trestle Thirty One
277,14.1%,"Napa Valley, Napa, California, US",750 ml,White, US,4/1/2021,"
                      Nutty, floral and earthy, this white has a crisp entry of wet stone and earthy white flower. Exotic and well integrated, it shows a lovely mix of pear, mango and peach that finds vibrancy through a backbone of balanced acidity.                      Virginie Boone ",Estate Grown,Grgich Hills 2017 Estate Grown Chardonnay (Napa Valley),$43, California,91, Napa,Napa Valley,Not rated yet [Add Your Review],Chardonnay,2017,Grgich Hills
278,14.1%,"Sonoma Coast, Sonoma, California, US",750 ml,White, US,4/1/2021,"
                      Creamy texture supports a core of Golden Delicious apple and crème caramel in this medium-bodied, richly layered white, given 16 months in French oak, 28% of it new. A backbone of crisp acidity keeps it fresh and vibrant from start to finish.                      Virginie Boone ",La Révolte,La Pitchoune 2016 La Révolte Chardonnay (Sonoma Coast),$48, California,91, Sonoma,Sonoma Coast,Not rated yet [Add Your Review],Chardonnay,2016,La Pitchoune
279,13.8%,"Carneros, Napa-Sonoma, California, US",750 ml,White, US,4/1/2021,"
                      Floral and exotic in stone fruit, with a succulent midpalate, this estate white shows a flourish of quince, peach and white fig, the acidity vibrantly wrapped around a firm, supple core of structure and elegance.                      Virginie Boone ",Estate,Ram's Gate 2018 Estate Chardonnay (Carneros),$76, California,91, Napa-Sonoma,Carneros,Not rated yet [Add Your Review],Chardonnay,2018,Ram's Gate
280,15%,"Livermore Valley, Central Coast, California, US",750 ml,White, US,4/1/2021,"
                      Butter, caramel and butterscotch nuances swirl through this golden-colored, full-bodied and luxuriously textured wine, strongly complementing the baked apple, honey and vanilla flavors for a very rich, concentrated expression.                      Jim Gordon ",Jewel Collection Series Estate Reserve,Ruby Hill Winery 2018 Jewel Collection Series Estate Reserve Chardonnay (Livermore Valley),$40, California,91, Central Coast,Livermore Valley,Not rated yet [Add Your Review],Chardonnay,2018,Ruby Hill Winery
281,14.6%,"Sta. Rita Hills, Central Coast, California, US",750 ml,White, US,4/1/2021,"
                      Dried apple and lemon-peel aromas meet with savory hints of dried herb and peanut shell on the nose of this bottling. There's a savory streak to the sip as well, where oregano adds to the dried citrus and toasted nut flavors.                      Matt Kettmann ",Reserve,Santa Barbara Winery 2018 Reserve Chardonnay (Sta. Rita Hills),$26, California,91, Central Coast,Sta. Rita Hills,Not rated yet [Add Your Review],Chardonnay,2018,Santa Barbara Winery
282,14.5%,"Carneros, Napa-Sonoma, California, US",750 ml,White, US,4/1/2021,"
                      Creamy and rounded in style, with ripe, rounded edges, this white from the great site shows a wealth of floral effusiveness and ample texture. Stone fruit and green apple mingle around vibrant, lengthy acidity and nuanced oak.                      Virginie Boone ",Hyde Vineyard,Bouchaine 2018 Hyde Vineyard Chardonnay (Carneros),$70, California,91, Napa-Sonoma,Carneros,Not rated yet [Add Your Review],Chardonnay,2018,Bouchaine
283,13.5%,"Willamette Valley, Willamette Valley, Oregon, US",750 ml,White, US,4/1/2021,"
                      Done in a fine-tuned, lightly spicy style, this offers focused fruit flavors of apple, melon and tangerine. It was organically farmed and barrel fermented, and though there's little evidence of new wood, a pleasant hint of coconut water rolls through the finish.                      Paul Gregutt ",Estate Bottled The Bard,Cardwell Hill 2019 Estate Bottled The Bard Chardonnay (Willamette Valley),$24, Oregon,91, Willamette Valley,Willamette Valley,Not rated yet [Add Your Review],Chardonnay,2019,Cardwell Hill
284,11.6%,"Willamette Valley, Willamette Valley, Oregon, US",750 ml,White, US,4/1/2021,"
                      This is the reserve label for Abbey Road Farm. It's a two-barrel selection from the same sources as the regular Chardonnay, but here one of the barrels was new, bringing strong scents of clove and cinnamon spice as the wine is poured. Pure apple fruit flavors carry out the impression of cinnamon, and the flavors hold firm though the mouthfeel seems to flatten out a bit through the back palate. Drink this over the next two or three years.                      Paul Gregutt ",,Wilkens Family 2018 Chardonnay (Willamette Valley),$70, Oregon,91, Willamette Valley,Willamette Valley,Not rated yet [Add Your Review],Chardonnay,2018,Wilkens Family
285,14.5%,"Monterey, Central Coast, California, US",750 ml,White, US,4/1/2021,"
                      Very clean lines of chalk, white melon and Meyer lemon peel make for a very pure entry to the nose of this bottling. It's tightly wound on the palate, moving from brisk lime to warmer lychee, toast and buttercream flavors toward the finish, yet retaining freshness throughout.                      Matt Kettmann ",Uncaged,Z. Alexander Brown 2018 Uncaged Chardonnay (Monterey),$16, California,91, Central Coast,Monterey,Not rated yet [Add Your Review],Chardonnay,2018,Z. Alexander Brown
286,13.5%,"North Fork of Long Island, Long Island, New York, US",750 ml,White, US,4/1/2021,"
                      A rich nose of sea spray, citrus cream, blanched almond, chamomile and yellow plum starts off this delightful Chardonnay. The medium-bodied palate is silken in feel yet drawn out by a taut line of acidity. Flavors of lemon peel, white blossoms and lemongrass are lifted and pure, with a delicate white tea note extending on the textured finish.                      Alexander Peartree ",Saddleback,Jamesport 2018 Saddleback Chardonnay (North Fork of Long Island),$27, New York,91, Long Island,North Fork of Long Island,Not rated yet [Add Your Review],Chardonnay,2018,Jamesport
287,14.2%,"Sonoma Coast, Sonoma, California, US",750 ml,White, US,4/1/2021,"
                      Bright and racy with a textured core of Meyer lemon and crushed rock, this wine impresses in its balance of richness and acidity. Secondary notes of brioche and oak come to the fore as it develops, finishing weighty and with length.                      Virginie Boone ",,The Calling 2018 Chardonnay (Sonoma Coast),$30, California,91, Sonoma,Sonoma Coast,Not rated yet [Add Your Review],Chardonnay,2018,The Calling
288,13.5%,"Carneros, Napa-Sonoma, California, US",750 ml,White, US,4/1/2021,"
                      Made in an elegant, austere and refined style, this tastes of apple skin, pear and just a hint of peach. With well-integrated oak providing a foundation, it has a rich underbelly of baking spice.                      Virginie Boone ",Sangiacomo Vineyards,Saintsbury 2018 Sangiacomo Vineyards Chardonnay (Carneros),$30, California,91, Napa-Sonoma,Carneros,Not rated yet [Add Your Review],Chardonnay,2018,Saintsbury
289,13.2%,"Napa Valley, Napa, California, US",750 ml,White, US,4/1/2021,"
                      Fermented in concrete tank and aged in neutral oak, this steely wine is delicately layered in lemon and papaya. It shows very good substance and style on the lengthy finish.                      Virginie Boone ",Y3,Jax 2019 Y3 Chardonnay (Napa Valley),$20, California,91, Napa,Napa Valley,Not rated yet [Add Your Review],Chardonnay,2019,Jax
290,12.5%,"Trento, Northeastern Italy, Italy",750 ml,Sparkling, Italy,4/1/2021,"
                      Aromas of yellow apple, hazelnut and brioche come to the forefront. These tones follow on to the palate alongside a lemon zest flavor set against racy acidity and a lively perlage.                      Kerin O’Keefe ",Perlé Brut,Ferrari 2015 Perlé Brut Chardonnay (Trento),$38, Northeastern Italy,91,Trento,,Not rated yet [Add Your Review],Chardonnay,2015,Ferrari
291,14.1%,"Napa Valley, Napa, California, US",750 ml,White, US,4/1/2021,"
                      With a touch of reduction and matchstick on the nose, this wine takes time to unfurl—its thick, rich opening notes finding a sense of lightness on the midpalate. Almond, apple and pineapple flavors are met by a mineral component of crushed rock and wet stone.                      Virginie Boone ",Paris Tasting Commemorative,Grgich Hills 2017 Paris Tasting Commemorative Chardonnay (Napa Valley),$97, California,91, Napa,Napa Valley,Not rated yet [Add Your Review],Chardonnay,2017,Grgich Hills
292,14.3%,"Sonoma County, Sonoma, California, US",750 ml,White, US,4/1/2021,"
                      Oaky, rich and layered, this likable white offers apple, peach, pear and a whirl of butterscotch, with the oak adding a toasted note. Softly textured and rounded on the palate, it brings complexity within a full-bodied style.                      Virginie Boone ",Overlook,Landmark 2018 Overlook Chardonnay (Sonoma County),$27, California,91, Sonoma,Sonoma County,Not rated yet [Add Your Review],Chardonnay,2018,Landmark
293,13.2%,"Santa Cruz Mountains, Central Coast, California, US",750 ml,White, US,4/1/2021,"
                      Very focused and citrus-driven scents of grapefruit and lemon peel kick off the nose of this bottling, which also shows hints of lychee, melon and a metallic minerality. It's tightly wound on the palate, where sharp lime and lemon-peel aromas lead into richer waves of macadamia nut, dried herb and light toast.                      Matt Kettmann ",Lester Family Vineyards,Lester 2018 Lester Family Vineyards Chardonnay (Santa Cruz Mountains),$37, California,91, Central Coast,Santa Cruz Mountains,Not rated yet [Add Your Review],Chardonnay,2018,Lester
294,13.8%,"Columbia Valley (WA), Columbia Valley, Washington, US",750 ml,White, US,4/1/2021,"
                      This wine comes from the recently approved Royal Slope appellation, and the aromas show pleasing subtlety, with notes of pear, crayon and wet stone. The lightly creamy stone fruit flavors are light on their feet, bringing the bright acidity typical of the vintage. The balance impresses, and it lingers on the finish.                      Sean P. Sullivan ",Stillwater Creek Vineyard,Saviah 2019 Stillwater Creek Vineyard Chardonnay (Columbia Valley (WA)),$25, Washington,91, Columbia Valley,Columbia Valley (WA),Not rated yet [Add Your Review],Chardonnay,2019,Saviah
295,12.5%,"Santa Maria Valley, Central Coast, California, US",750 ml,White, US,4/1/2021,"
                      Sharp aromas of lime peel and lychee are very tart and brisk on the nose of this bottling from the Sierra Madre Vineyard. The palate is also laser sharp and stinging with acidity, which will mellow with time and allow the grapefruit-peel and apple-flesh flavors to come forward.                      Matt Kettmann ",Sierra Madre Vineyard,Lumen 2019 Sierra Madre Vineyard Chardonnay (Santa Maria Valley),$40, California,90, Central Coast,Santa Maria Valley,Not rated yet [Add Your Review],Chardonnay,2019,Lumen
296,14.9%,"Monterey, Central Coast, California, US",750 ml,White, US,4/1/2021,"
                      Aromas of Meyer lemon, butter, daffodil, cream and a hint of steely minerality show on the nose of this bottling. There is solid tension on the palate, where roasted lemon, peach and apple flavors meet with a hint of smoke.                      Matt Kettmann ",Estate Reserve,Maddalena 2018 Estate Reserve Chardonnay (Monterey),$20, California,90, Central Coast,Monterey,Not rated yet [Add Your Review],Chardonnay,2018,Maddalena
297,13.7%,"Sonoma Coast, Sonoma, California, US",750 ml,White, US,4/1/2021,"
                      This tiny-production wine from the famous coastal site is austere and steely in style, with a wealth of great acidity. Textured and balanced, it sings in apple, pear and wet stone, it was fermented in both concrete egg and neutral French oak.                      Virginie Boone ",Platt Vineyard Baby Platt,Riley's Rows 2018 Platt Vineyard Baby Platt Chardonnay (Sonoma Coast),$39, California,90, Sonoma,Sonoma Coast,Not rated yet [Add Your Review],Chardonnay,2018,Riley's Rows
298,11.9%,"Willamette Valley, Willamette Valley, Oregon, US",750 ml,White, US,4/1/2021,"
                      A 50-50 blend of Yamhill-Carlton and Ribbon Ridge fruit, this outperforms the listed low alcohol degree of ripeness. It's crisp and lean to be sure, with ample lime, grapefruit and green apple flavors firmly framed with phenolic highlights from whole-cluster pressing. No new oak was used.                      Paul Gregutt ",,Abbey Road Farm 2018 Chardonnay (Willamette Valley),$37, Oregon,90, Willamette Valley,Willamette Valley,Not rated yet [Add Your Review],Chardonnay,2018,Abbey Road Farm
299,13.9%,"Sonoma Coast, Sonoma, California, US",750 ml,White, US,4/1/2021,"
                      This is a clear, focused white, balanced and complex, with a lush midpalate. Apple, pear and stone fruit combine with ease around integrated oak and a lasting thread of baking spice.                      Virginie Boone ",,Amici 2017 Chardonnay (Sonoma Coast),$25, California,90, Sonoma,Sonoma Coast,Not rated yet [Add Your Review],Chardonnay,2017,Amici
300,11.8%,"North Fork of Long Island, Long Island, New York, US",750 ml,White, US,4/1/2021,"
                      Zesty aromas of lemon and lime peels ride over delicate creamy yeast in this unoaked Chardonnay. There's a gentle creaminess to the medium-bodied palate, filled out by juicy flavors of yellow apple and pear. A mild salty accent gives some pleasing depth to an otherwise brisk expression.                      Alexander Peartree ",Highwire,Hound's Tree 2017 Highwire Chardonnay (North Fork of Long Island),$18, New York,90, Long Island,North Fork of Long Island,Not rated yet [Add Your Review],Chardonnay,2017,Hound's Tree
301,14.18%,"Petaluma Gap, Sonoma, California, US",750 ml,White, US,4/1/2021,"
                      Nutty, earthy and toasty, this estate-grown white has a steely undercurrent of pulsing acidity that keeps it vibrant and fresh. Strong flavors of pear highlight a medium-bodied palate of integrated flavors and texture.                      Virginie Boone ",La Cruz,Keller 2019 La Cruz Chardonnay (Petaluma Gap),$45, California,90, Sonoma,Petaluma Gap,Not rated yet [Add Your Review],Chardonnay,2019,Keller
302,13.6%,"Sonoma County, Sonoma, California, US",750 ml,White, US,4/1/2021,"
                      Barrel-fermented and given 10 months in French oak, this is an impressive and value-minded white with wide appeal. Rounded and balanced, it shows structured layers of steely flint, green apple and peach.                      Virginie Boone ",,Valravn 2019 Chardonnay (Sonoma County),$20, California,90, Sonoma,Sonoma County,Not rated yet [Add Your Review],Chardonnay,2019,Valravn
303,13.7%,"Columbia Valley (WA), Columbia Valley, Washington, US",750 ml,White, US,4/1/2021,"
                      The aromas offer notes of candlewax and crayon. There's plenty of deftness to the lightly creamy flavors, keeping the interest high, with lovely balance to it all.                      Sean P. Sullivan ",Lawrence Vineyards,Gård 2018 Lawrence Vineyards Chardonnay (Columbia Valley (WA)),$28, Washington,90, Columbia Valley,Columbia Valley (WA),Not rated yet [Add Your Review],Chardonnay,2018,Gård
304,14%,"Santa Cruz Mountains, Central Coast, California, US",750 ml,White, US,4/1/2021,"
                      There's a unique and intriguing show of terroir that comes through each vintage on this wine. Alkaline aromas of baking soda and lemon pith meet with light apricot and nectarine on the nose. The palate combines dried lemon and pear peels with a strong rocky character.                      Matt Kettmann ",Gravel Ridge Vineyard,Cooper-Garrod 2018 Gravel Ridge Vineyard Chardonnay (Santa Cruz Mountains),$33, California,90, Central Coast,Santa Cruz Mountains,Not rated yet [Add Your Review],Chardonnay,2018,Cooper-Garrod
305,14.3%,"Russian River Valley, Sonoma, California, US",750 ml,White, US,4/1/2021,"
                      Seamless and stone-driven, this wine is steely with a touch of pineapple and peach. Medium bodied, it delivers fruity richness that is balanced by well-integrated acidity.                      Virginie Boone ",LB,Mueller 2017 LB Chardonnay (Russian River Valley),$36, California,90, Sonoma,Russian River Valley,Not rated yet [Add Your Review],Chardonnay,2017,Mueller
306,14.3%,"Napa Valley, Napa, California, US",750 ml,White, US,4/1/2021,"
                      A rich opening of spicy oak and cinnamon red hots leads the way to a midpalate of rich and rounded varietal style in this well-made, value-minded wine. Delivering texture and flavor, it finishes in a viscous layering of honey and crème brûlée.                      Virginie Boone ",Allomi,Hess Collection 2019 Allomi Chardonnay (Napa Valley),$36, California,90, Napa,Napa Valley,Not rated yet [Add Your Review],Chardonnay,2019,Hess Collection
307,13.4%,"North Fork of Long Island, Long Island, New York, US",750 ml,White, US,4/1/2021,"
                      Aromas of blossomy white flowers, crushed salt and lime peel carry the driven nose. There's a gentle creaminess to the medium-bodied palate, with savory elements of blanched almond and salt leading over gently seared lemon. It ends nutty yet lifted.                      Alexander Peartree ",,Hound's Tree 2017 Chardonnay (North Fork of Long Island),$26, New York,90, Long Island,North Fork of Long Island,Not rated yet [Add Your Review],Chardonnay,2017,Hound's Tree
308,13.9%,"Arroyo Seco, Central Coast, California, US",750 ml,White, US,4/1/2021,"
                      Opulent aromas of ripe pear, gardenia, apple and coconut show on the nose of this bottling. It's racy with acidity on the sip, where a tart lemon flavor leads into apple blossom, poached pear and pineapple, with a slight butter tone on the finish.                      Matt Kettmann ",Riverstone,J. Lohr 2019 Riverstone Chardonnay (Arroyo Seco),$14, California,90, Central Coast,Arroyo Seco,Not rated yet [Add Your Review],Chardonnay,2019,J. Lohr
309,12.8%,"North Fork of Long Island, Long Island, New York, US",750 ml,White, US,4/1/2021,"
                      Aromas of brûléed lemon, fresh citrus peels and sea spray are energetic and lifted on the nose of this barrel-aged Chardonnay. There's a silky richness to the medium-bodied palate, yet it's driven by a taut line of acidity that extends to the finish. A delicate frame of toasty spice accents the crisp fruit, making this a well-balanced offering.                      Alexander Peartree ",Estate Reserve,One Woman 2017 Estate Reserve Chardonnay (North Fork of Long Island),$42, New York,90, Long Island,North Fork of Long Island,Not rated yet [Add Your Review],Chardonnay,2017,One Woman
310,14.2%,"Santa Lucia Highlands, Central Coast, California, US",750 ml,White, US,4/1/2021,"
                      Dried lemon-peel, honeysuckle and kiwi aromas show on the nose of this bottling from renowned viticulturist Steve McIntyre's estate. Brisk flavors of lemon juice and light nectarine meet with hints of underripe pineapple on the sip.                      Matt Kettmann ",McIntyre Estate Vineyard,McIntyre Vineyards 2018 McIntyre Estate Vineyard Chardonnay (Santa Lucia Highlands),$38, California,90, Central Coast,Santa Lucia Highlands,Not rated yet [Add Your Review],Chardonnay,2018,McIntyre Vineyards
311,13.5%,"Dundee Hills, Willamette Valley, Oregon, US",750 ml,White, US,4/1/2021,"
                      This complex, organically grown block selection dramatically reflects the winery's dedication to native yeasts, minimal intervention and mixed fermentation vessels. It's got a wild streak a mile wide, which may delight some palates and mystify others. The tart peach and citrus flavors turn sour as they wind down, with numerous details of pollen and yeast and herbal tea.                      Paul Gregutt ",North Blocks,White Walnut 2018 North Blocks Chardonnay (Dundee Hills),$55, Oregon,90, Willamette Valley,Dundee Hills,Not rated yet [Add Your Review],Chardonnay,2018,White Walnut
312,14.1%,"Sonoma Coast, Sonoma, California, US",750 ml,White, US,4/1/2021,"
                      Steely and crisp in green apple and pear, this balanced white also features an intriguing note of anise. Aged 16 months in French oak, 33% of it new, it is medium bodied in texture and body weight.                      Virginie Boone ",Pratt Vineyard,La Pitchoune 2016 Pratt Vineyard Chardonnay (Sonoma Coast),$58, California,90, Sonoma,Sonoma Coast,Not rated yet [Add Your Review],Chardonnay,2016,La Pitchoune
