,Alcohol,Appellation,Bottle Size,Category,Country,Date Published,Description,Designation,Name,Price,Province,Rating,Region,Subregion,User Avg Rating,Variety,Vintage,Winery
0,13.5%,"Carneros, Napa-Sonoma, California, US",750 ml,White, US,7/1/2021,"
                      This is a stunner from blocks planted in 1997 and 1999. Beautiful aromas of toasted hazelnut and stone lead to a palate that shows undeniable minerality paired with lasting acidity. It shows freshness and energy throughout. Drink 2026–2032.                      Virginie Boone ",Hyde Vineyard,Ramey 2018 Hyde Vineyard Chardonnay (Carneros),$70, California,100, Napa-Sonoma,Carneros,Not rated yet [Add Your Review],Chardonnay,2018,Ramey
1,14.5%,"Russian River Valley, Sonoma, California, US",750 ml,White, US,7/1/2021,"
                      This wine is a testament to an outstanding site in the hands of an outstanding producer. It is a celebration of fresh Meyer lemon and Gravenstein apple woven against an elegant structure and quenching acidity.                      Virginie Boone ",Rochioli Vineyard,Ramey 2018 Rochioli Vineyard Chardonnay (Russian River Valley),$70, California,100, Sonoma,Russian River Valley,Not rated yet [Add Your Review],Chardonnay,2018,Ramey
2,14.5%,"Russian River Valley, Sonoma, California, US",750 ml,White, US,7/1/2021,"
                      Quenchingly fresh, complex and structured, this wine balances lushness and rounded edges of richness with vibrant acidity and length. From the producer's own 75-acre ranch, this vintage comes from a block planted in 1989. Gravenstein apple, pear and a note of nutmeg accent a stony texture of graceful tension.                      Virginie Boone ",Westside Farms Estate,Ramey 2018 Westside Farms Estate Chardonnay (Russian River Valley),$70, California,98, Sonoma,Russian River Valley,Not rated yet [Add Your Review],Chardonnay,2018,Ramey
3,14.5%,"Russian River Valley, Sonoma, California, US",750 ml,White, US,7/1/2021,"
                      From older plantings on a wide-spaced site—one the producer has worked with for some time—this wine is complicated and wild, combining rich, elegant flavors of salty sea breeze with ginger and lemon puree. Seamless and supple, it has a backbone of structure and lively acidity that pair effortlessly with the apple and pear.                      Virginie Boone ",Ritchie Vineyard,Ramey 2018 Ritchie Vineyard Chardonnay (Russian River Valley),$70, California,98, Sonoma,Russian River Valley,Not rated yet [Add Your Review],Chardonnay,2018,Ramey
4,14.5%,"Russian River Valley, Sonoma, California, US",750 ml,White, US,7/1/2021,"
                      From a site in the heart of the appellation farmed by the Martinelli family, from cuttings that can be traced back to Hyde Vineyard, this white dazzles in salty sea air, oyster shell and hay, with subdued richness and layers of Gravenstein apple and pear. The acidity drives it into a fresh array of tension and texture.                      Virginie Boone ",Woolsey Road Vineyard,Ramey 2018 Woolsey Road Vineyard Chardonnay (Russian River Valley),$70, California,95, Sonoma,Russian River Valley,Not rated yet [Add Your Review],Chardonnay,2018,Ramey
5,14.5%,"Russian River Valley, Sonoma, California, US",750 ml,White, US,7/1/2021,"
                      An incredible showcase for the appellation, this combines grapes from the producer's estate Westside Farms with Dutton, Woolsey Road and Rochioli Allen, among others. Together it is broadly floral, earthy and richly integrated, with depth and complexity, the acidity vibrantly fresh.                      Virginie Boone ",,Ramey 2018 Chardonnay (Russian River Valley),$42, California,95, Sonoma,Russian River Valley,Not rated yet [Add Your Review],Chardonnay,2018,Ramey
6,13.5%,"Willamette Valley, Willamette Valley, Oregon, US",750 ml,White, US,7/1/2021,"
                      Scrumptious pretty much sums it up. This rare reserve—the winery's first since 1999—honors its 30th vintage. Plush malolactic and new barrel flavors abound: buttered popcorn, brioche, apple pie and lemon custard in a big pile. It's smooth and rich and nicely balanced, though more for near-term drinking than long-term aging.                      Paul Gregutt ",Reserve,Argyle 2017 Reserve Chardonnay (Willamette Valley),$35, Oregon,94, Willamette Valley,Willamette Valley,Not rated yet [Add Your Review],Chardonnay,2017,Argyle
7,13.8%,"Eola-Amity Hills, Willamette Valley, Oregon, US",750 ml,White, US,7/1/2021,"
                      Deeply extracted flavors of Meyer lemon, apple and peach are cloaked in lighter touches of new oak. Some 20% of the barrels were new, and the wine spent about a year and a half aging prior to bottling in March 2020. The wine soaks in deliciously, completely coating the palate and lingering down and through an extended finish with hints of butter and roasted peanuts.                      Paul Gregutt ",Elton Vineyard,Lavinea 2018 Elton Vineyard Chardonnay (Eola-Amity Hills),$60, Oregon,94, Willamette Valley,Eola-Amity Hills,Not rated yet [Add Your Review],Chardonnay,2018,Lavinea
8,13%,"Chassagne-Montrachet, Burgundy, France",750 ml,White, France,7/1/2021,"
                      On the slope south of the village of Chassagne-Montrachet, this vineyard is in the heart of the line of premier crus. This wine is textured, shot through with minerality and ripe fruits. Toast and spice give extra richness and soften the still-young acidity. The wine is still maturing, so wait to drink until 2023.                      Roger Voss ",Les Fairendes Premier Cru,Domaine Coffinet-Duvernay 2018 Les Fairendes Premier Cru  (Chassagne-Montrachet),$134, Burgundy,94,Chassagne-Montrachet,,Not rated yet [Add Your Review],Chardonnay,2018,Domaine Coffinet-Duvernay
9,12.5%,"Santa Cruz Mountains, Central Coast, California, US",750 ml,White, US,7/1/2021,"
                      Wet stone, damp earth and woolly aromas are lifted by lemon pith on the intriguing, minerali-driven nose of this single-vineyard expression. The palate is framed by a fantastically tense structure, presenting crisp, bright and stony flavors of rainy cement, yuzu peel and grapefruit pith.                      Matt Kettmann ",Toyon Vineyard,Madson 2019 Toyon Vineyard Chardonnay (Santa Cruz Mountains),$40, California,94, Central Coast,Santa Cruz Mountains,Not rated yet [Add Your Review],Chardonnay,2019,Madson
10,13%,"Chablis, Burgundy, France",750 ml,White, France,7/1/2021,"
                      From arguably the grandest of the Chablis Grand Crus, this wine has dense richness, pure white fruits and the lightest touches of wood aging. The wine is well balanced, with fruitiness that contrasts with the mineral, tight texture. Age this wine and drink from 2024.                      Roger Voss ",Les Clos Grand Cru,Defaix Frères 2019 Les Clos Grand Cru  (Chablis),$130, Burgundy,94,Chablis,,Not rated yet [Add Your Review],Chardonnay,2019,Defaix Frères
11,13.3%,"Chehalem Mountains, Willamette Valley, Oregon, US",750 ml,White, US,7/1/2021,"
                      This is a very fine effort—detailed, balanced and powerful. The fruit mix artfully conjures up ripe pear, peach, apricot and papaya, lightly spiced. The wine gains weight and length through the palate, adding a wash of nut butter during a long, lush fade.                      Paul Gregutt ",Jacob-Hart Estate Vineyard,Rex Hill 2017 Jacob-Hart Estate Vineyard Chardonnay (Chehalem Mountains),$60, Oregon,94, Willamette Valley,Chehalem Mountains,Not rated yet [Add Your Review],Chardonnay,2017,Rex Hill
12,13%,"Chablis, Burgundy, France",750 ml,White, France,7/1/2021,"
                      This is a concentrated and rich wine. With dense white-fruit flavors encased in spice and vanilla, the wine is ripe and sure to age well. It is very young and will take its time. Drink from 2024.                      Roger Voss ",Bougros Grand Cru,Defaix Frères 2019 Bougros Grand Cru  (Chablis),$120, Burgundy,94,Chablis,,Not rated yet [Add Your Review],Chardonnay,2019,Defaix Frères
13,14.1%,"Santa Maria Valley, Central Coast, California, US",750 ml,White, US,7/1/2021,"
                      Tightly wound aromas of lemon peel, citrus blossom, pomelo pith and nectarine make for a tense and engaging nose in this bottling. Fierce mineral streaks of crushed sea shell and rocks overcome the palate, where flashes of apple flesh and jicama also arise.                      Matt Kettmann ",Sierra Madre Vineyard,Tread 2019 Sierra Madre Vineyard Chardonnay (Santa Maria Valley),$40, California,94, Central Coast,Santa Maria Valley,Not rated yet [Add Your Review],Chardonnay,2019,Tread
14,12.3%,"Sonoma Coast, Sonoma, California, US",750 ml,White, US,7/1/2021,"
                      This delightfully memorable wine is crisp, floral and herbal, a gorgeously structured and complex expression of lengthy acidity, lemon zest and green apple. From a great cool-climate site, it captures the crisp air and ocean influence with ease.                      Virginie Boone ",H. Klopp Vineyard,Reeve 2018 H. Klopp Vineyard Chardonnay (Sonoma Coast),$68, California,94, Sonoma,Sonoma Coast,Not rated yet [Add Your Review],Chardonnay,2018,Reeve
15,13.3%,"Sta. Rita Hills, Central Coast, California, US",750 ml,White, US,7/1/2021,"
                      Tight lime and Mandarin peel aromas meet with tart pear flesh on the sharp and crisp nose of this bottling. At first, the palate is driven by intense mineral flavors of chalk, and then waves of baked lemon, toast and sea salt slide in, making for complex enjoyment.                      Matt Kettmann ",Ashley's,Fess Parker 2019 Ashley's Chardonnay (Sta. Rita Hills),$44, California,94, Central Coast,Sta. Rita Hills,Not rated yet [Add Your Review],Chardonnay,2019,Fess Parker
16,13%,"Chablis, Burgundy, France",750 ml,White, France,7/1/2021,"
                      From the coolest of the premier crus, this wine is as much about texture as fruit. Young and taut with touches of spice and a steely edge, the wine is just setting out. Drink from 2023.                      Roger Voss ",Côte de Lechet Premier Cru,Les Hauts de Milly 2019 Côte de Lechet Premier Cru  (Chablis),$45, Burgundy,93,Chablis,,Not rated yet [Add Your Review],Chardonnay,2019,Les Hauts de Milly
17,14%,"Pouilly-Fuissé, Burgundy, France",750 ml,White, France,7/1/2021,"
                      From one of the terroirs of Pouilly-Fuissé that became recognized as a cru from the 2020 vintage, this wine shows class, richness and ripe yellow fruits. It is a full wine, spicy and with room for further aging. Drink this wine from 2023.                      Roger Voss ",Vers Cras,Domaine des Granges 2018 Vers Cras  (Pouilly-Fuissé),$57, Burgundy,93,Pouilly-Fuissé,,Not rated yet [Add Your Review],Chardonnay,2018,Domaine des Granges
18,13.1%,"Anderson Valley, Mendocino County, California, US",750 ml,White, US,7/1/2021,"
                      This dramatic wine offers a tantalizing bread-dough aroma that leads to bold flavors of toasted oak, baked apple, nutmeg and butter. Medium in body, it's wrapped in a smooth texture that also retains a tang of crisp acidity for good balance.                      Jim Gordon ",,Carpe Diem 2018 Chardonnay (Anderson Valley),$23, California,93, Mendocino County,Anderson Valley,Not rated yet [Add Your Review],Chardonnay,2018,Carpe Diem
19,13%,"Chablis, Burgundy, France",750 ml,White, France,7/1/2021,"
                      This wine's richness and concentration is impressive. With touches of wood aging giving spice and vanilla flavors, the wine is beautifully ripe. Yellow fruits and kiwi convey richness and a crisp, tangy aftertaste. Drink from 2023.                      Roger Voss ",Montée de Tonnerre Premier Cru,Defaix Frères 2019 Montée de Tonnerre Premier Cru  (Chablis),$60, Burgundy,93,Chablis,,Not rated yet [Add Your Review],Chardonnay,2019,Defaix Frères
20,13.9%,"Sta. Rita Hills, Central Coast, California, US",750 ml,White, US,7/1/2021,"
                      This winery's Chardonnays have existed on their own unique plane since the days when Greg Brewer was the winemaker. There's a yogurt-like dairy kick to the nose alongside orange peel, dried pear and sea salt. The palate is zesty with acidity and loaded with a range of citrus-peel and pith flavors plus a flash of guava, with a grippy texture pushing into the zippy finish.                      Matt Kettmann ",Estate,Melville 2018 Estate Chardonnay (Sta. Rita Hills),$38, California,93, Central Coast,Sta. Rita Hills,Not rated yet [Add Your Review],Chardonnay,2018,Melville
21,13.5%,"Russian River Valley, Sonoma, California, US",750 ml,White, US,7/1/2021,"
                      With a rich, dense and fruity nose of baked pear and tropical crème brûlée, this wine is broadly fleshy and lush, with underlying crispness that contrasts and keeps it effortlessly fresh. The bottle is incredibly heavy, but the wine is nicely light.                      Virginie Boone ",Sullivan Vineyard Dutton Ranch,The Calling 2018 Sullivan Vineyard Dutton Ranch Chardonnay (Russian River Valley),$51, California,93, Sonoma,Russian River Valley,Not rated yet [Add Your Review],Chardonnay,2018,The Calling
22,13%,"Chassagne-Montrachet, Burgundy, France",750 ml,White, France,7/1/2021,"
                      Close to the village, this vineyard has produced a rich, full wine, layering acidity with toast, and freshness with ripe yellow fruits. The well-structured wine is marked with chiseled freshness and still maturing. Drink from 2022.                      Roger Voss ",Les Blanchots Dessous,Domaine Coffinet-Duvernay 2018 Les Blanchots Dessous  (Chassagne-Montrachet),$100, Burgundy,93,Chassagne-Montrachet,,Not rated yet [Add Your Review],Chardonnay,2018,Domaine Coffinet-Duvernay
23,12.5%,"Santa Cruz Mountains, Central Coast, California, US",750 ml,White, US,7/1/2021,"
                      This bottling begins with an intriguing yogurt note and then shifts into lemon curd, wet cement and crushed oyster shells on a fascinating, maritime-like line. That mix of tart dairy and crushed sea shells is also redolent throughout the palate, where lemongrass and key-lime-pith flavors add depth.                      Matt Kettmann ",Les Enfants de Soleil,Madson 2018 Les Enfants de Soleil Chardonnay (Santa Cruz Mountains),$32, California,93, Central Coast,Santa Cruz Mountains,Not rated yet [Add Your Review],Chardonnay,2018,Madson
24,14.1%,"Sta. Rita Hills, Central Coast, California, US",750 ml,White, US,7/1/2021,"
                      Tightly woven aromas of Meyer lemon peel, a hint of hard nectarine and the lightest brush of butter show on the nose of this bottling from the first spot to plant Chardonnay in the region. There's a great grip to the sip, where fresh citrus and stone-fruit flavors are wrapped in racy acidity and hints of stone and toast.                      Matt Kettmann ",Sanford & Benedict,Fess Parker 2019 Sanford & Benedict Chardonnay (Sta. Rita Hills),$40, California,93, Central Coast,Sta. Rita Hills,Not rated yet [Add Your Review],Chardonnay,2019,Fess Parker
25,13.2%,"Anderson Valley, Mendocino County, California, US",750 ml,White, US,7/1/2021,"
                      Seductive aromas of caramel and toast lead to buttery, apple-tart flavors on a medium body. This wine is nicely freshened by good green-apple acidity and stays relatively light in texture. Fermented by native yeast and aged in just 12% new oak, it is built for aging. Best from 2024.                      Jim Gordon ",Bahl Briney,Drew 2018 Bahl Briney Chardonnay (Anderson Valley),$32, California,92, Mendocino County,Anderson Valley,Not rated yet [Add Your Review],Chardonnay,2018,Drew
26,13%,"Los Carneros, Napa-Sonoma, California, US",750 ml,White, US,7/1/2021,"
                      Barrel-fermented and given nearly a year in 20% new oak, this white is ripe in apple and pear flavors, with an underlying richness of crème brûlée and flan. Lengthy and complex, it has measured lushness that gets a lift from crisp acidity.                      Virginie Boone ",Hundred Knot,RD 2019 Hundred Knot Chardonnay (Los Carneros),$35, California,92, Napa-Sonoma,Los Carneros,Not rated yet [Add Your Review],Chardonnay,2019,RD
27,14.5%,"Arroyo Seco, Central Coast, California, US",750 ml,White, US,7/1/2021,"
                      Lemon blossom, nectarine, damp sand and the lightest touch of butter make for a compelling nose. It's very racy on the palate, with a brisk lemon-juice flavor that cuts through the rounded tones of nectarine and apricot.                      Matt Kettmann ",Dijon Clone,Scott Family 2018 Dijon Clone Chardonnay (Arroyo Seco),$36, California,92, Central Coast,Arroyo Seco,Not rated yet [Add Your Review],Chardonnay,2018,Scott Family
28,14.5%,"North Coast, North Coast, California, US",750 ml,White, US,7/1/2021,"
                      This full-bodied, robust wine sports toasted oak and browned butter aromas followed by ripe Bosc pear and toasted almond flavors on a rich, mouthfilling texture. It is big and well balanced, offering lots of flavor along with appetizing structure.                      Jim Gordon ",Eleanora's Selection,Buena Vista 2018 Eleanora's Selection Chardonnay (North Coast),$44, California,92, North Coast,North Coast,Not rated yet [Add Your Review],Chardonnay,2018,Buena Vista
29,12.6%,"Ribbon Ridge, Willamette Valley, Oregon, US",750 ml,White, US,7/1/2021,"
                      Sourced from the Armstrong Vineyard atop Ribbon Ridge, this is an expressive wine with compelling minerality. The citrus fruits are tart and complex, running the gamut from lemon to grapefruit to orange. It's a sappy, tangy, textured, low alcohol style with a pleasing, lingering snap to the finish.                      Paul Gregutt ",Evening Primrose,Red Electric 2018 Evening Primrose Chardonnay (Ribbon Ridge),$33, Oregon,92, Willamette Valley,Ribbon Ridge,Not rated yet [Add Your Review],Chardonnay,2018,Red Electric
30,12.5%,"Bourgogne Côte d’Or, Burgundy, France",750 ml,White, France,7/1/2021,"
                      From vines on the edge of Puligny-Montrachet, this wine has a good pedigree. Fermented in wood, it has a toasty character that promises well for the future. Vanilla and spice go with fresh kiwi and apple flavors. Drink the wine from 2022.                      Roger Voss ",Chardonnay,Domaine Jean Chartron 2019 Chardonnay  (Bourgogne Côte d’Or),$26, Burgundy,92,Bourgogne Côte d’Or,,Not rated yet [Add Your Review],Chardonnay,2019,Domaine Jean Chartron
31,13.7%,"Santa Barbara County, Central Coast, California, US",750 ml,White, US,7/1/2021,"
                      Meyer lemon peel, white peach and a chalky tone show on the nose of this county blend—a new offering from Zaca Mesa. The palate is tense and loaded with lemon peel, nectarine and sea salt flavors.                      Matt Kettmann ",,Tread 2019 Chardonnay (Santa Barbara County),$35, California,92, Central Coast,Santa Barbara County,Not rated yet [Add Your Review],Chardonnay,2019,Tread
32,13.1%,"Chehalem Mountains, Willamette Valley, Oregon, US",750 ml,White, US,7/1/2021,"
                      Sourced from Dick Erath's 1968 planting, this shows the power and precision of old vine fruit, along with unique clones from Mount Eden and Calera. A wonderful time-travel wine, this mixes green apple, citrus and green melon fruit with softer flavors from aging in once-used French oak.                      Paul Gregutt ",Flood Line,Averaen 2019 Flood Line Chardonnay (Chehalem Mountains),$35, Oregon,92, Willamette Valley,Chehalem Mountains,Not rated yet [Add Your Review],Chardonnay,2019,Averaen
33,13%,"Pouilly-Fuissé, Burgundy, France",750 ml,White, France,7/1/2021,"
                      A sumptuous and tropical-fruit-flavored wine, this is ripe and densely textured. A touch of the minerality of Pouilly-Fuissé is almost overwhelmed by the concentrated fruitiness. Drink the wine from 2022.                      Roger Voss ",Vers Châne,Château de Lavernette 2018 Vers Châne  (Pouilly-Fuissé),$59, Burgundy,92,Pouilly-Fuissé,,Not rated yet [Add Your Review],Chardonnay,2018,Château de Lavernette
34,13%,"Chassagne-Montrachet, Burgundy, France",750 ml,White, France,7/1/2021,"
                      With rich fruits and a good balance between freshness and toastiness, this wine is subtle in its complexities. White-fruit and apple flavors give the wine a concentrated character, sliced with acidity and spice. Drink from 2023.                      Roger Voss ",,Domaine Coffinet-Duvernay 2018  Chassagne-Montrachet,$80, Burgundy,92,Chassagne-Montrachet,,Not rated yet [Add Your Review],Chardonnay,2018,Domaine Coffinet-Duvernay
35,14%,"Pouilly-Fuissé, Burgundy, France",750 ml,White, France,7/1/2021,"
                      Wood aging in large and small barrels has given this ripe, young wine extra richness. With its full spice and touches of yellow fruits the wine should age well. Drink from 2022.                      Roger Voss ",,Domaine des Granges 2019  Pouilly-Fuissé,$35, Burgundy,92,Pouilly-Fuissé,,Not rated yet [Add Your Review],Chardonnay,2019,Domaine des Granges
36,12.5%,"Santa Maria Valley, Central Coast, California, US",750 ml,White, US,7/1/2021,"
                      Lean and rocky on the nose at first, this steadily picks up warmer aromas of Pink Lady apple while retaining the wet stone and sea-shell sense. The palate grips with tight, crushed rock minerality, offering toasted almond warmth as a counterpoint.                      Matt Kettmann ",Vino de los Ranchos,Scar of the Sea 2019 Vino de los Ranchos Chardonnay (Santa Maria Valley),N/A, California,92, Central Coast,Santa Maria Valley,Not rated yet [Add Your Review],Chardonnay,2019,Scar of the Sea
37,13%,"Chablis, Burgundy, France",750 ml,White, France,7/1/2021,"
                      This freshest of the premier cru vineyards has produced a very crisp wine. Ripe yellow fruits and red apples show through spice and touches of vanilla. This wine is young and will be best from 2022.                      Roger Voss ",Côte de Lechet Premier Cru,Defaix Frères 2019 Côte de Lechet Premier Cru  (Chablis),$45, Burgundy,92,Chablis,,Not rated yet [Add Your Review],Chardonnay,2019,Defaix Frères
38,14.3%,"Chalone, Central Coast, California, US",750 ml,White, US,7/1/2021,"
                      Pure yet restrained aromas of white peach, butterscotch and sea salt make for an inviting entry to the nose of this bottling from a single block and clone. The palate is full in body, comforting yet not over the top, offering white peach and baked pear as well as cinnamon, hazelnut and crème brûlée flavors.                      Matt Kettmann ",Chalone Vineyard,Armida 2018 Chalone Vineyard Chardonnay (Chalone),$45, California,92, Central Coast,Chalone,Not rated yet [Add Your Review],Chardonnay,2018,Armida
39,14.1%,"Sta. Rita Hills, Central Coast, California, US",750 ml,White, US,7/1/2021,"
                      Very stony and chalky on the nose, this appellation blend offers light Asian pear, jicama, lime blossom and lemongrass on the nose. There's tremendous grip to the palate, framing otherwise delicate hints of Meyer lemon and brisk apple that ride laser-sharp acidity into the finish.                      Matt Kettmann ",,Tread 2019 Chardonnay (Sta. Rita Hills),$46, California,92, Central Coast,Sta. Rita Hills,Not rated yet [Add Your Review],Chardonnay,2019,Tread
40,13%,"Chablis, Burgundy, France",750 ml,White, France,7/1/2021,"
                      This premier cru from a cool vineyard site offers ripe fruit intensity and a richness to the texture. Despite the roundness, it still remains crisp and spicy, aided by a touch of vanilla. Drink from 2022.                      Roger Voss ",Côte de Lechet Premier Cru,Defaix Frères 2018 Côte de Lechet Premier Cru  (Chablis),$45, Burgundy,92,Chablis,,Not rated yet [Add Your Review],Chardonnay,2018,Defaix Frères
41,13%,"Willamette Valley, Willamette Valley, Oregon, US",750 ml,White, US,7/1/2021,"
                      The impact of the pandemic on the wine industry has led more than a few top-tier wineries to offer exceptional wines at bargain prices (relative to their past catalog). Here's one—a compendium of Willamette Valley grapes in a sculpted, vivid, sappy and accessible Chardonnay. Well-balanced apple, citrus, melon and white peach fruit are nicely ripened, blended and balanced. Drink now and over the next half decade.                      Paul Gregutt ",La Combe Verte,Walter Scott 2019 La Combe Verte Chardonnay (Willamette Valley),$28, Oregon,92, Willamette Valley,Willamette Valley,Not rated yet [Add Your Review],Chardonnay,2019,Walter Scott
42,14.1%,"Sonoma County, Sonoma, California, US",750 ml,White, US,7/1/2021,"
                      This line of wine by Bibiana González Rave punches above its weight. This bottling starts with aromas of tight pear, jasmine, white rose and Pink Lady apple on the nose. The palate is very tight in structure, yet delivers joyous white-flower flavors and racy acidity.                      Matt Kettmann ",,Alma de Cattleya 2019 Chardonnay (Sonoma County),$26, California,92, Sonoma,Sonoma County,Not rated yet [Add Your Review],Chardonnay,2019,Alma de Cattleya
43,13.4%,"Santa Lucia Highlands, Central Coast, California, US",750 ml,White, US,7/1/2021,"
                      There's a light touch of butter and macadamia nut on the nose of this bottling, which warms up the baked lemon and stony aromas. The palate is wrapped in a chalky tension, delivering flavors of lemon glaze, toasted apple and a rugged, sandstone-like minerality.                      Matt Kettmann ",Escolle Vineyard,I. Brand & Family 2018 Escolle Vineyard Chardonnay (Santa Lucia Highlands),$30, California,92, Central Coast,Santa Lucia Highlands,Not rated yet [Add Your Review],Chardonnay,2018,I. Brand & Family
